status_id,status_message,link_name,status_type,status_link,status_published,num_reactions,num_comments,num_shares,num_likes,num_loves,num_wows,num_hahas,num_sads,num_angrys
107861655950370_1404166032986586,"Index Vijesti: Tableti, prenosivi DVD plejeri, laptopi, kamere, fotoaparati, igraće konzole i e-knjige morat će biti smješteni u prtljazi koja ne ulazi u kabinu.","Teroristička prijetnja raste, Amerika zabranila unošenje elektronike u zrakoplove",link,http://www.index.hr/vijesti/clanak/panika-u-sadu-isis-ima-novu-metodu-kako-unijeti-bombu-u-avion-koju-je-tesko-otkriti/958343.aspx,2017-03-22 10:32:16,2,2,0,2,0,0,0,0,0
107861655950370_1404165916319931,"Index Mame: Stručnjaci ističu da, ako dijete do 18 mjeseci ne hoda samostalno, ali je zdravo i općenito dobro napreduje, ne treba tražiti pomoć liječnika",Znate li koje sve korake bebe odrađuju prije svog prvog pravog koraka?,link,http://www.index.hr/mame/clanak/znate-li-koje-sve-korake-bebe-odraduju-prije-svog-prvog-pravog-koraka-/738422.aspx,2017-03-22 10:32:10,6,1,2,6,0,0,0,0,0
107861655950370_1404165822986607,Index Vijesti: Sadr smatra da će se odnosi između sunita i šiita pogoršati kada ostanu bez zajedničkog neprijatelja.,Vojni zapovjednik i političar upozorava: Poraz ISIS-a u Mosulu mogao bi dovesti do genocida,link,http://www.index.hr/vijesti/clanak/vojni-zapovjednik-i-politicar-upozorava-poraz-isisa-u-mosulu-mogao-bi-dovesti-do-genocida/958442.aspx,2017-03-22 10:32:04,2,0,0,2,0,0,0,0,0
107861655950370_1404165732986616,"Imitiranje je najiskreniji oblik laskanja, kažu ;)",FOTO I Rozga fura čizme koje je Severini za skoro 9000 kuna kupila Todorićeva kći,link,http://www.index.hr/black/clanak/foto-i-rozga-fura-cizme-koje-je-severini-za-skoro-9000-kuna-kupila-todoriceva-kci/958436.aspx,2017-03-22 10:31:58,73,67,3,58,1,0,8,0,6
107861655950370_1404165692986620,,Vozači Formule 1 zbog novih pravila vježbali start više nego ikada prije,link,http://www.index.hr/sport/clanak/vozaci-formule-1-zbog-novih-pravila-vjezbali-start-vise-nego-ikada-prije/957918.aspx,2017-03-22 10:31:53,63,1,1,61,1,0,0,1,0
107861655950370_1404165659653290,Index Sport: Nitko ne zna što je htio poručiti.,Zabio jedan od najljepših golova sezone pa trenera gađao dresom,link,http://www.index.hr/sport/clanak/zabio-jedan-od-najljepsih-golova-sezone-pa-trenera-gadao-dresom/958440.aspx,2017-03-22 10:31:48,9,0,0,9,0,0,0,0,0
107861655950370_1404165599653296,Index Rouge: Ocijenite same jeste li dovoljno hrabre za nositi ovako nešto ;),Za ovako nositi traperice treba imati hrabrosti,link,http://www.index.hr/rouge/clanak/za-ovako-nositi-traperice-treba-imati-hrabrosti/958363.aspx,2017-03-22 10:31:43,9,1,0,8,0,0,0,0,1
107861655950370_1404165572986632,Sjetili su se i najvećeg gafa iz njene prošlosti.,"FOTO Lidija Bačić jednim komentarom pokazala (ne)znanje, fanovi je popljuvali",link,http://www.index.hr/black/clanak/foto-lidija-bacic-jednim-komentarom-pokazala-neznanje-fanovi-je-popljuvali/958446.aspx,2017-03-22 10:31:39,77,21,1,65,3,1,8,0,0
107861655950370_1404165526319970,Je li i vas oborila s nogu?,"""Ljepota mi je upropastila život, muškarci su me progonili na svakom koraku""",link,http://www.index.hr/black/clanak/ljepota-mi-je-upropastila-zivot-muskarci-su-me-progonili-na-svakom-koraku/958420.aspx,2017-03-22 10:31:35,69,14,0,65,2,0,2,0,0
107861655950370_1404165459653310,Index Vijesti: LIJEK bi mogao smanjiti posljedice moždanog udara za oko 80 posto.,REVOLUCIONARNO Konačno otkriven lijek za moždani udar – otrov najotrovnijeg pauka,link,http://www.index.hr/vijesti/clanak/revolucionarno-konacno-otkriven-lijek-za-mozdani-udar--otrov-najotrovnijeg-pauka/958414.aspx,2017-03-22 10:31:29,336,9,69,313,10,11,2,0,0
107861655950370_1404165406319982,,PONUDA DA VAM SE ZAVRTI City ruši svjetski rekord za čudesnog klinca,link,http://www.index.hr/sport/clanak/ponuda-da-vam-se-zavrti-city-rusi-svjetski-rekord-za-cudesnog-klinca-/958441.aspx,2017-03-22 10:31:26,92,1,0,90,0,2,0,0,0
107861655950370_1404165352986654,Index Sport: Leo Messi ga želi u Barceloni.,Igrač koji je trebao biti vođa Juventusa želi napustiti Torino: Karijeru nastavlja u Realu ili Barceloni,link,http://www.index.hr/sport/clanak/igrac-koji-je-trebao-biti-voda-juventusa-zeli-napustiti-torino-karijeru-nastavlja-u-realu-ili-barceloni/958443.aspx,2017-03-22 10:31:20,63,0,0,60,1,0,2,0,0
107861655950370_1404165289653327,"Index Vijesti: Jako zahlađenje u unutrašnjosti, snijeg u gorju, travanj donosi temperature ispod nule!","DRASTIČNA PROMJENA Stiže jako zahlađenje, temperature idu blizu ništice, u gorju snijeg",link,http://www.index.hr/vijesti/clanak/drasticna-promjena-stize-jako-zahladenje-temperature-idu-blizu-nistice-a-opet-ce-padati-i-snijeg/958439.aspx,2017-03-22 10:31:13,703,101,152,481,15,84,23,30,70
107861655950370_1404133209656535,"RAZVOJ DOGAĐAJA PRATITE NA INDEXU.

Policija objavila: Ovo je teroristički napad.","TEROR U LONDONU Manijak autom gazio ljude pa izbo policajca, raste broj mrtvih",link,http://www.index.hr/vijesti/clanak/dvije-sobe-upucane-ispred-britanskog-parlamenta/958445.aspx,2017-03-22 09:54:46,62,31,9,38,0,7,1,13,3
107861655950370_1404119842991205,Index Sport: Opet su baklje bile najveći problem,Stigle nove kazne: Istra i Lokomotiva plaćaju divljanje Torcide i BBB-a,link,http://www.index.hr/sport/clanak/stigle-nove-kazne-istra-i-lokomotiva-placaju-divljanje-torcide-i-bbba/958387.aspx,2017-03-22 09:38:14,16,9,0,13,0,0,3,0,0
107861655950370_1404119769657879,Index Fit: Danas vam je zadan baš cijeli izazov!,20. DAN Index Fit HIIT izazova: Pokrenite se u cijelosti!,link,http://www.index.hr/fit/clanak/20-dan-index-fit-hiit-izazova-pokrenite-se-u-cijelosti/958413.aspx,2017-03-22 09:38:08,1,0,0,1,0,0,0,0,0
107861655950370_1404119686324554,Index Vijesti: Teško je protumačiti poruku na ijedan drugi način.,"Je li Erdogan upravo zaprijetio Europljanima terorizmom? ""Nećete moći hodati sigurno ulicom""",link,http://www.index.hr/vijesti/clanak/je-li-erdogan-upravo-zaprijetio-europljanima-terorizmom-necete-moci-hodati-sigurno-ulicom/958404.aspx,2017-03-22 09:37:59,106,90,8,39,1,5,9,3,49
107861655950370_1404119602991229,Index Sport: Hoćete li gledati utakmicu?,"Ulaznice gotovo rasprodane, Hrvatsku i Ukrajina igraju na punom Maksimiru",link,http://www.index.hr/sport/clanak/ulaznice-gotovo-rasprodane-hrvatska-i-ukrajina-igraju-na-punom-maksimiru/958430.aspx,2017-03-22 09:37:54,267,50,2,254,11,0,2,0,0
107861655950370_1404119542991235,"Index Rouge: Još jedan uspjeh hrvatske dizajnerice, bravo! :)","Slavna ""Spajsica"" u haljini naše Aleksandre Dojčinović",link,http://www.index.hr/rouge/clanak/slavna-spajsica-u-haljini-nase-aleksandre-dojcinovic/958406.aspx,2017-03-22 09:37:49,58,0,0,58,0,0,0,0,0
107861655950370_1404119436324579,Index Sport: Bio bi to strašan udarac!,"Za nekoliko mjeseci Euro u Hrvatskoj, a Duvnjaku prijeti višemjesečna pauza",link,http://www.index.hr/sport/clanak/za-nekoliko-mjeseci-euro-u-hrvatskoj-a-duvnjaku-prijeti-duza-pauza-/958399.aspx,2017-03-22 09:37:44,31,0,0,31,0,0,0,0,0
107861655950370_1404119312991258,Ne bismo voljeli biti na njenom mjestu.,"VIDEO Pogledajte snimku koja je nasmijala internet: ""Mislim da više nikad neću biti suha""",link,http://www.index.hr/black/clanak/video-pogledajte-snimku-koja-je-nasmijala-internet-mislim-da-vise-nikad-necu-biti-suha/958388.aspx,2017-03-22 09:37:38,9,2,0,8,1,0,0,0,0
107861655950370_1404119246324598,Index Fit: Uživajte u slasnom zalogaju koji pršti od zdravlja,"Super ukusne, a tako fit - špagete od tikvica s Alfredo umakom",link,http://www.index.hr/fit/clanak/super-ukusne-a-tako-fit--spagete-od-tikvica-s-alfredo-umakom-/958393.aspx,2017-03-22 09:37:33,66,1,7,65,1,0,0,0,0
107861655950370_1404119172991272,Samo opušteno.,FOTO Bella Hadid zapalila Instagram fotografijom u toplessu,link,http://www.index.hr/black/clanak/foto-bella-hadid-objavila-fotku-u-toplesu-instagram-poludio/958397.aspx,2017-03-22 09:37:30,27,2,0,27,0,0,0,0,0
107861655950370_1404119099657946,Likovi iz emisije za djecu.,FOTO SDP-ovci izgledaju kao da su ispali iz Muppet showa,link,http://www.index.hr/black/clanak/foto-sdpovci-izgledaju-kao-da-su-ispali-iz-muppet-showa/958391.aspx,2017-03-22 09:37:25,39,16,2,31,0,0,8,0,0
107861655950370_1404118976324625,,Izbornik objasnio Englezima zašto još nisu prvaci svijeta,link,http://www.index.hr/sport/clanak/izbornik-objasnio-englezima-zasto-jos-nisu-prvaci-svijeta/958418.aspx,2017-03-22 09:37:21,1,0,0,1,0,0,0,0,0
107861655950370_1404118832991306,Index Vijesti: Strašno ubojstvo u Sloveniji.,"ZLOČIN U SLOVENIJI Bratu i baki odrubio glavu, stavio ih u užarenu peć pa pozvao policiju",link,http://www.index.hr/vijesti/clanak/zlocin-u-sloveniji-bratu-i-baki-odrubio-glavu-stavio-ih-u-uzarenu-pec-pa-pozvao-policiju/958419.aspx,2017-03-22 09:37:15,12,2,2,8,0,0,0,0,4
107861655950370_1404118786324644,Godišnje zaradi više od milijun dolara.,"FOTO Borila se s depresijom, a danas zarađuje 80 tisuća kuna po objavi na Instagramu",link,http://www.index.hr/black/clanak/foto-borila-se-s-depresijom-a-danas-zaraduje-80-tisuca-kuna-po-objavi-na-instagramu/958428.aspx,2017-03-22 09:37:11,11,0,0,11,0,0,0,0,0
107861655950370_1404118686324654,Rusija ove godine neće imati predstavnika na Eurosongu.,Rusiji zabranjen nastup na Eurosongu,link,http://www.index.hr/black/clanak/rusiji-zabranjen-nastup-na-eurosongu/958424.aspx,2017-03-22 09:37:06,45,23,0,32,3,0,2,2,6
107861655950370_1404118592991330,Neki su padali i u nesvijest.,VIDEO Ovaj film je toliko brutalan da u kinu dijele vrećice za povraćanje prije prikazivanja,link,http://www.index.hr/black/clanak/video-ovaj-film-je-toliko-brutalan-da-u-kinu-dijele-vrecice-za-povracanje-prije-prikazivanja/958421.aspx,2017-03-22 09:37:03,229,69,11,205,1,8,11,1,3
107861655950370_1404118532991336,Na Balkanu se kriju ljudi sa supermoćima.,FOTO Bore se za 25.000 eura: Upoznajte Riječanku i Zagrepčanina sa supermoćima,link,http://www.index.hr/black/clanak/foto-bore-se-za-25000-eura-upoznajte-rijecanku-i-zagrepcanina-sa-supermocima/958407.aspx,2017-03-22 09:36:59,4,3,0,4,0,0,0,0,0
107861655950370_1404118396324683,Index Sport: Transfer koji će dodatno zaoštriti odnose španjolskih divova,"Real ne pušta ""izdajnika"" Isca, Barca mu nudi bogatstvo ako ih ostavi bez odštete",link,http://www.index.hr/sport/clanak/real-ne-pusta-izdajnika-isca-barca-mu-nudi-bogatstvo-ako-iz-madrida-ode-bez-odstete/958409.aspx,2017-03-22 09:36:53,16,0,0,16,0,0,0,0,0
107861655950370_1404118229658033,Index Vijesti: Dobrodošlica za objavu kandidature za gradonačelnika Dubrovnika,Zastupniku Mosta isparali sve četiri gume na autu,link,http://www.index.hr/vijesti/clanak/zastupniku-mosta-isparali-sve-cetiri-gume-na-autu/958426.aspx,2017-03-22 09:36:47,56,21,3,26,4,2,17,3,4
107861655950370_1404118092991380,Index Rouge: Body shaming je prevršio svaku mjeru!,Bode li vas doista ovo prijateljstvo toliko u oči?!,link,http://www.index.hr/rouge/clanak/bode-li-vas-doista-ovo-prijateljstvo-toliko-u-oci/958386.aspx,2017-03-22 09:36:41,302,56,3,267,21,2,3,8,1
107861655950370_1404117999658056,Index Vijesti: Sjećate se ove fotografije?,Sjećate se žene koja je postala simbol terorističkog napada na Bruxelles? Evo gdje je danas,link,http://www.index.hr/vijesti/clanak/sjecate-se-zene-koja-je-postala-simbol-teroristickog-napada-na-bruxelles-evo-gdje-je-danas/958411.aspx,2017-03-22 09:36:35,17,0,0,17,0,0,0,0,0
107861655950370_1404081079661748,Samo rekreativno :D,Jeste li kralj masturbacije ili obični drkadžija? U pet minuta saznajte jeste li ovisni o pornićima,link,http://www.index.hr/black/clanak/jeste-li-kralj-masturbacije-ili-obicni-drkadjija-u-pet-minuta-saznajte-jeste-li-ovisni-o-pornicima/958396.aspx,2017-03-22 08:59:29,94,51,4,86,0,0,8,0,0
107861655950370_1403618253041364,Još jedna predivna ponuda s Index Oglasi ;),Index Oglasi,link,http://www.index.hr/oglasi/land-rover-defender-90-2-5tdi-prvi-vlasnik-128tkm/oid/454744?utm_source=facebook&utm_medium=social&utm_campaign=facebook_objava_m&utm_content=454744,2017-03-22 08:20:00,25,6,0,16,3,0,6,0,0
107861655950370_1403791329690723,,Lajk.hr,link,http://www.index.hr/lajk/poster/185046/meso-im-se-zgadilo-kad-su-vidjeli-sto-im-pise-na-racunu,2017-03-22 07:50:00,24,1,0,14,0,0,10,0,0
107861655950370_1403990983004091,GLASAJTE U INDEXOVOJ ANKETI!,VELIKA ANKETA Koga želite za gradonačelnika Zagreba?,link,http://www.index.hr/vijesti/clanak/velika-anketa-koga-zelite-za-gradonacelnika-zagreba/958365.aspx,2017-03-22 07:20:00,71,164,7,63,5,0,1,0,2
107861655950370_1403990076337515,Ima smisla.,"Evo što nije u redu s vama zovete li partnera u krevetu ""tatice""",link,http://www.index.hr/black/clanak/seksologinja-otkrila-sto-nije-u-redu-s-vama-zovete-li-partnera-u-krevetu-tatice/958370.aspx,2017-03-22 07:04:09,7,0,0,7,0,0,0,0,0
107861655950370_1403990023004187,Index Fit: Super lijene vježbe za koje vam treba samo elastična traka,"Dvije ""lijene"" vježbe za jačanje nogu, guze, ruku i tijela",link,http://www.index.hr/fit/clanak/dvije-lijene-vjezbe-za-jacanje-nogu-guze-ruku-i-tijela-/958361.aspx,2017-03-22 07:04:05,5,0,0,5,0,0,0,0,0
107861655950370_1403989983004191,Nogometaš se jako veseli sinu.,"Dinamovac slavi: ""Stiže sinčić""",link,http://www.index.hr/black/clanak/dinamovac-slavi-stize-sincic/958376.aspx,2017-03-22 07:04:01,23,0,0,23,0,0,0,0,0
107861655950370_1403989933004196,,Napoli krenuo u akciju dovođenja i trećeg Hrvata,link,http://www.index.hr/sport/clanak/napoli-krenuo-u-akciju-dovodenja-kovacica/958383.aspx,2017-03-22 07:03:57,17,0,0,17,0,0,0,0,0
107861655950370_1403989899670866,"Index Vijesti: Kažu kako s porastom temperature, raste i broj ilegalnih migranata.",Sve više ljudi pokušava ilegalno ući u Srbiju,link,http://www.index.hr/vijesti/clanak/sve-vise-ljudi-pokusava-ilegalno-uci-u-srbiju/958369.aspx,2017-03-22 07:03:52,3,0,1,3,0,0,0,0,0
107861655950370_1403989856337537,,"Ovako izgleda inicijacija novih ""Zmajeva"": Dinamov talent pjevao kao Halid",link,http://www.index.hr/sport/clanak/ovako-izgleda-inicijacija-novih-zmajeva-dinamov-talent-pjevao-kao-halid/958379.aspx,2017-03-22 07:03:47,23,1,0,23,0,0,0,0,0
107861655950370_1403989799670876,"Zbog ljubavi su i uhićeni, no tvrde da ih ništa ne može spriječiti.","Majka i sin u ljubavnoj vezi: ""On je ljubav mog života, ništa ne može stati između nas""",link,http://www.index.hr/black/clanak/majka-i-sin-u-ljubavnoj-vezi-on-je-ljubav-mog-zivota-nista-ne-moze-stati-izmedu-nas/958359.aspx,2017-03-22 07:03:43,169,212,5,41,2,8,24,18,76
107861655950370_1403989746337548,Index Vijesti: Je li Marić u sukobu interesa?,Rejting agencije ne vjeruju Agrokorovim izvješćima za koja je bio zadužen Zdravko Marić,link,http://www.index.hr/vijesti/clanak/rejting-agencije-ne-vjeruju-agrokorovim-izvjescima-za-koja-je-bio-zaduzen-zdravko-maric/958322.aspx,2017-03-22 07:03:38,191,70,28,105,0,10,53,0,23
107861655950370_1403961003007089,Index Vijesti: FOTO Jedna osoba je ozlijeđena zbog posljedica udisanja dima.,"FOTO Novi požar na Jarunu: Vatra planula na drugom katu stambene zgrade, jedna osoba ozlijeđena",link,http://www.index.hr/vijesti/clanak/foto-novi-pozar-na-jarunu-vatra-planula-na-drugom-katu-stambene-zgrade-jedna-osoba-ozlijedena/958357.aspx,2017-03-22 06:26:31,5,0,1,5,0,0,0,0,0
107861655950370_1403960939673762,Index Vijesti: Nova desničarska zvijezda priznala kandidaturu za Zagreb!,"Bruna Esih: Da, kandidirat ću se za gradonačelnicu Zagreba",link,http://www.index.hr/vijesti/clanak/bruna-esih-da-kandidirat-cu-se-za-gradonacelnicu-zagreba/958356.aspx,2017-03-22 06:26:26,186,63,3,120,5,0,40,4,17
107861655950370_1403960886340434,Index Vijesti: Jedna u nizu mjera.,Islamska zajednica u BiH donijela nove mjere protiv ekstremizma i radikalizacije,link,http://www.index.hr/vijesti/clanak/islamska-zajednica-u-bih-donijela-nove-mjere-protiv-ekstremizma-i-radikalizacije/958368.aspx,2017-03-22 06:26:21,8,0,0,8,0,0,0,0,0
107861655950370_1403960843007105,"Index Vijesti: ""Institucionalno nasilje iz odmazde""",SABOR O HRVATSKIM STUDIJIMA Glavašević: Odluke Uprave mi izazivaju mučninu,link,http://www.index.hr/vijesti/clanak/glavasevic-u-saboru-naoruzani-policajci-na-hrvatskim-studijima-mi-izazivaju-mucninu/958360.aspx,2017-03-22 06:26:15,18,10,0,15,2,0,1,0,0
107861655950370_1403960773007112,Nije krivac samo hrana.,Često se osjećate naduto? Iznenadit će vas što bi mogao biti uzrok,link,http://www.index.hr/black/clanak/cesto-se-osjecate-naduto-iznenadit-ce-vas-sto-bi-mogao-biti-uzrok/958362.aspx,2017-03-22 06:26:10,21,5,0,21,0,0,0,0,0
107861655950370_1403960673007122,Sjećate li se legendarne scene u kadi?,Seks simbol bivše Jugoslavije: Snimala gola u kadi s djevojkom svog ljubavnika,link,http://www.index.hr/black/clanak/zbog-gole-scene-u-kadi-bila-je-seks-simbol-jugoslavije-a-danas-je-nazivaju-kraljicom-sapunica/958337.aspx,2017-03-22 06:26:07,20,0,0,20,0,0,0,0,0
107861655950370_1403960599673796,Index Sport: Hajdukovci izvrijeđani na domaćem terenu!,"Hajdukovci brutalno izvrijeđani u Kaštel Starom: ""Gubo, nikad nećete biti prvi, zato je Dinamo tu gdje je""",link,http://www.index.hr/sport/clanak/hajdukovci-brutalno-izvrijedani-u-kastel-starom-gubo-nikad-necete-biti-prvi-zato-je-dinamo-tu-gdje-je/958364.aspx,2017-03-22 06:26:02,36,8,0,31,0,0,4,0,1
107861655950370_1403960569673799,Index Sport: A tek mu je 18 godina,REAL RUŠI REKORD Za tinejdžera koji je zaludio svijet nudi 120 milijuna eura,link,http://www.index.hr/sport/clanak/real-rusi-rekord-za-tinejdjera-koji-je-zaludio-svijet-nudi-120-milijuna-eura/958344.aspx,2017-03-22 06:25:58,133,0,1,130,0,1,2,0,0
107861655950370_1403960519673804,"Index Sport: Cijela ga Europa želi, pa i Liverpool!",BOMBA S ANFIELDA Klopp nudi 30 milijuna funti za sjajnog hrvatskog reprezentativca,link,http://www.index.hr/sport/clanak/bomba-s-anfielda-klopp-nudi-30-milijuna-funti-za-sjajnog-hrvatskog-reprezentativca/958349.aspx,2017-03-22 06:25:52,143,3,1,140,3,0,0,0,0
107861655950370_1403935399676316,Index Vijesti: Istražitelji će pokušati otkriti tko je misteriozni prijatelj.,"Novi skandal u francuskoj izbornoj kampanji: Fillon od ""prijatelja"" dobio odijela vrijedna 13.000 €?",link,http://www.index.hr/vijesti/clanak/novi-skandal-u-francuskoj-izbornoj-kampanji-fillon-od-prijatelja-dobio-odijela-vrijedna-13000-/958352.aspx,2017-03-22 05:48:19,3,1,1,3,0,0,0,0,0
107861655950370_1403935333009656,Index Vijesti: Oni koji su ostali bez stipendije imaju pravo prigovora,"Ured za Hrvate izvan Hrvatske dodijelio 500 stipendija, od toga 400 onima koji studiraju u BiH",link,http://www.index.hr/vijesti/clanak/ured-za-hrvate-izvan-hrvatske-dodijelio-500-stipendija-od-toga-400-onima-koji-studiraju-u-bih/958341.aspx,2017-03-22 05:48:13,102,27,8,37,1,3,27,4,30
107861655950370_1403935266342996,Index Vijesti: Bunjac napao poskupljenje cestarina.,Bunjac: Hrvatima će biti jeftinije iz Zagreba za Split putovati avionom nego autocestom,link,http://www.index.hr/vijesti/clanak/bunjac-hrvatima-ce-biti-jeftinije-iz-zagreba-za-split-putovati-avionom-nego-autocestom/958347.aspx,2017-03-22 05:48:07,538,67,12,446,4,2,54,7,25
107861655950370_1403935183009671,,Srbiji trebala četiri mjeseca da u škole uvede informatiku kao obavezni predmet,link,http://www.index.hr/vijesti/clanak/srbiji-trebala-cetiri-mjeseca-da-u-skole-uvede-informatiku-kao-obavezni-predmet/958339.aspx,2017-03-22 05:48:03,36,21,8,35,0,0,1,0,0
107861655950370_1403935129676343,Index Mame: Osim lijepe uspomene babicama je važnije na taj način osigurati se da bebe slučajno ne zamijene u rodilištima ili da ih mogu identificirati u slučaju otmice,Kako bi bilo divno da i naše babice u rodilištima rade ovo s bebama,link,http://www.index.hr/mame/clanak/kako-bi-bilo-divno-da-i-nase-babice-u-rodilistima-rade-ovo-s-bebama-/958348.aspx,2017-03-22 05:47:58,48,4,0,42,6,0,0,0,0
107861655950370_1403935096343013,,"VIDEO: U Volkswagenu je seks savršen, a ovaj video to i dokazuje",link,http://www.index.hr/auto/clanak/video-u-volkswagenu-je-seks-savrsen-a-ovaj-video-to-i-dokazuje/958350.aspx,2017-03-22 05:47:53,64,4,3,55,0,0,8,0,1
107861655950370_1403935036343019,Zgodna Mirta opet je oduševila svoje brojne muške fanove.,FOTO Može li haljinica Mirte Šurjak biti kraća?,link,http://www.index.hr/black/clanak/foto-moze-li-haljinica-mirte-surjak-biti-kraca/958342.aspx,2017-03-22 05:47:49,70,15,1,66,3,0,1,0,0
107861655950370_1403934906343032,"Index Vijesti: Uniforme stižu ekspresnom brzinom, ali sigurnost učenika nije prioritet.","POZNATA ZAGREBAČKA GIMNAZIJA U RASPADNOM STANJU Prozor pao na učenika, roditelji bijesni na grad",link,http://www.index.hr/vijesti/clanak/poznata-zagrebacka-gimnazija-u-raspadnom-stanju-prozor-pao-na-ucenika-roditelji-bijesni-na-grad/958289.aspx,2017-03-22 05:47:43,209,81,36,107,3,4,7,35,53
107861655950370_1403934853009704,"Uh, neugodno :D",VIDEO Svi pričaju o Rihanninoj snimci seksa,link,http://www.index.hr/black/clanak/video-svi-pricaju-o-rihanninoj-snimci-seksa/958346.aspx,2017-03-22 05:47:40,16,0,0,16,0,0,0,0,0
107861655950370_1403934779676378,Index Vijesti: Čak je dodao novo ime na Facebooku.,FOTO Što to Tomislav S. čita u Saboru?,link,http://www.index.hr/vijesti/clanak/foto-sto-to-tomislav-s-cita-u-saboru/958345.aspx,2017-03-22 05:47:33,8,21,0,8,0,0,0,0,0
107861655950370_1403911793012010,Index Rouge: Lijepo lice zapravo je svako pravilno njegovano lice :),Znate li da u kuhinji imate sastojak koji može pomladiti vašu kožu?,link,http://www.index.hr/rouge/clanak/znate-li-da-u-kuhinji-imate-sastojak-koji-moze-pomladiti-vasu-kozu/958057.aspx,2017-03-22 05:10:16,17,0,5,17,0,0,0,0,0
107861655950370_1403911769678679,,Aston Martin Rapide će prvi prijeći na struju,link,http://www.index.hr/auto/clanak/aston-martin-rapide-ce-prvi-prijeci-na-struju/958208.aspx,2017-03-22 05:10:12,9,1,0,8,0,0,0,0,1
107861655950370_1403911693012020,Index Rouge: Samo jedan kostimić je platila 10 tisuća dolara :D,Tko plaća skupe dizajnerske krpice Melanije Trump?,link,http://www.index.hr/rouge/clanak/tko-placa-skupe-dizajnerske-krpice-melanije-trump/958324.aspx,2017-03-22 05:10:04,30,36,1,24,2,1,3,0,0
107861655950370_1403911656345357,,"Bore se za opstanak u petoj ligi, a platili su skoro milijun eura za izgradnju samo jedne tribine",link,http://www.index.hr/sport/clanak/bore-se-za-opstanak-u-petoj-ligi-a-platili-su-skoro-milijun-eura-za-izgradnju-samo-jedne-tribine/958334.aspx,2017-03-22 05:10:01,86,3,2,81,3,0,2,0,0
107861655950370_1403911623012027,Mnogi su postali ljubomorni na peciva :P,VIDEO Najpoznatija plus size mankenka ogromne grudi sakrila - pecivom,link,http://www.index.hr/black/clanak/video-najpoznatija-plus-size-mankenka-ogromne-grudi-sakrila--pecivom/958331.aspx,2017-03-22 05:09:58,64,4,1,63,0,0,1,0,0
107861655950370_1403911593012030,"Poljska je odbila njegovo izručivanje, no sad bi se mogao vratiti sam.",Roman Polanski napokon pred sudom za silovanje 13-godišnjakinje prije 40 godina,link,http://www.index.hr/black/clanak/roman-polanski-napokon-pred-sudom-za-silovanje-13godisnjakinje-prije-40-godina/958314.aspx,2017-03-22 05:09:55,10,1,0,6,0,0,0,0,4
107861655950370_1403911399678716,"Index Vijesti: ""Nemaš pojma kako je frustrirajuće vratiti se starcima i dijeliti sobu s 10 godina starijim neoženjenim bratom. Kad vidim njega, kao da gledam sebe u budućnosti"".","Mladi u RH prisiljeni živjeti s roditeljima: ""Nemaš pojma kako je frustrirajuće vratiti se starcima""",link,http://www.index.hr/vijesti/clanak/mladi-u-rh-prisiljeni-zivjeti-s-roditeljima-nemas-pojma-kako-je-frustrirajuce-vratiti-se-starcima/958335.aspx,2017-03-22 05:09:49,255,38,17,175,1,1,9,65,4
107861655950370_1403911349678721,Index Vijesti: Odali počast preminulim zastupnicima,Božo Petrov pozvao na minutu šutnje u Saboru,link,http://www.index.hr/vijesti/clanak/bozo-petrov-pozvao-na-minutu-sutnje-u-saboru/958338.aspx,2017-03-22 05:09:44,9,19,1,9,0,0,0,0,0
107861655950370_1403911289678727,Index Vijesti: Detaljno je pojasnio put novca,"Krunski svjedok na suđenju Vidoševiću: ""Slao sam lažne račune HGK-u i prao novac""",link,http://www.index.hr/vijesti/clanak/krunski-svjedok-na-sudenju-vidosevicu-slao-sam-lazne-racune-hgku-i-prao-novac/958330.aspx,2017-03-22 05:09:39,107,51,23,62,2,15,6,2,20
107861655950370_1403911243012065,,"Čovjek koji je trebao biti novi Jordan: ""Sviđa mi se Šarić, neustrašiv je i pun je samopouzdanja!""",link,http://www.index.hr/sport/clanak/derrick-rose-saric-je-neustrasiv/958332.aspx,2017-03-22 05:09:35,31,0,0,31,0,0,0,0,0
107861655950370_1403911196345403,Index Sport: Rooney je odlučio gdje želi nastaviti karijeru,Rooney se odriče milijuna kako bi opet igrao za voljeni klub,link,http://www.index.hr/sport/clanak/rooney-se-odrice-milijuna-kako-bi-opet-igrao-za-voljeni-klub/958317.aspx,2017-03-22 05:09:32,101,1,0,100,1,0,0,0,0
107861655950370_1403911149678741,"Index Mame: Sve bi vam ovo sigurno poželjela reći i neka samohrana mama, ali joj se vjerojatno o tome više uopće ne da raspravljati na sav glas","8 stvari koje samohrane mame misle, ali vam to nikada neće otvoreno reći",link,http://www.index.hr/mame/clanak/8-stvari-koje-samohrane-mame-misle-ali-vam-to-nikada-nece-otvoreno-reci-/958333.aspx,2017-03-22 05:09:28,333,10,96,315,13,0,0,5,0
107861655950370_1403911093012080,Index Auto: Nema mjesta pogreškama,VIDEO Ovo još niste vidjeli: Pogledajte kako Bugatti testira motor od 1.500 KS,link,http://www.index.hr/auto/clanak/video-ovo-jos-niste-vidjeli-pogledajte-kako-bugatti-testira-motor-od-1500-ks/958340.aspx,2017-03-22 05:09:24,161,1,2,161,0,0,0,0,0
107861655950370_1403889853014204,Index Vijesti: Desnu nogu zarobljenu nožem od freze oslobodili su vatrogasci.,Teško ozlijeđen: Muškarcu u Trilju freza zahvatila noge,link,http://www.index.hr/vijesti/clanak/tesko-ozlijeden-muskarcu-u-trilju-freza-zahvatila-noge/958321.aspx,2017-03-22 04:32:22,4,2,0,4,0,0,0,0,0
