status_id,status_message,link_name,status_type,status_link,status_published,num_reactions,num_comments,num_shares,num_likes,num_loves,num_wows,num_hahas,num_sads,num_angrys
107861655950370_1405471522856037,Uskoro bivši vlasnik ovog Audija besplatno je predao oglas na Index Oglasima... baš kao i deseci tisuća drugih korisnika ;),Index Oglasi,link,http://www.index.hr/oglasi/audi-a5-2-0-tdi-sport-s-line-177-ks-automatik/oid/456955?utm_source=facebook&utm_medium=social&utm_campaign=facebook_objava_mz&utm_content=456955,2017-03-24 06:30:00,3,0,0,3,0,0,0,0,0
107861655950370_1405962392806950,"Index Sport: Prijelomna transfer vijest!

Jose Mourinho došao po sjajnog Hrvata u Zagreb!",ENGLEZI OBJAVILI SENZACIJU Mourinho je sletio u Zagreb! Osobno je došao je po reprezentativca Hrvatske,link,http://www.index.hr/sport/clanak/englezi-objavili-senzaciju-mourinho-je-sletio-u-zagreb-osobno-je-dosao-po-reprezentativca-hrvatske-/958905.aspx,2017-03-24 06:14:17,287,17,5,280,1,3,3,0,0
107861655950370_1405938976142625,Strukić :D,FOTO Promjena izgleda: Što se dogodilo s Kolindinim strukom?,link,http://www.index.hr/black/clanak/foto-promjena-izgleda-sto-se-dogodilo-s-kolindinim-strukom/958878.aspx,2017-03-24 05:37:08,138,123,5,93,0,0,34,3,8
107861655950370_1405915096145013,Index Sport: U deset utakmica gol razlika 20:5,TVRĐAVA MAKSIMIR Samo je Štimac uspio pokvariti fantastičan skor u Zagrebu,link,http://www.index.hr/sport/clanak/tvrdava-maksimir-samo-je-stimac-uspio-pokvariti-fantastican-skor-u-zagrebu/958859.aspx,2017-03-24 05:00:05,11,5,1,11,0,0,0,0,0
107861655950370_1405915059478350,Index Vijesti: Uznemiravao moralne osjećaje prolaznica,Mahao spolovilom pred prolaznicama u Požegi,link,http://www.index.hr/vijesti/clanak/mahao-penisom-pred-prolaznicama-u-pozegi-pa-zaradio-optuznicu/958876.aspx,2017-03-24 04:59:59,160,134,9,81,2,2,68,0,7
107861655950370_1405915009478355,Index Vijesti: Motornom pilom sam je rezao hrast,"U Brezničkom Humu rezao hrast motorkom, stablo puklo i ubilo ga na licu mjesta",link,http://www.index.hr/vijesti/clanak/u-breznickom-humu-rezao-hrast-motorkom-stablo-puklo-i-ubilo-ga-na-licu-mjesta/958879.aspx,2017-03-24 04:59:53,12,2,0,6,0,0,0,6,0
107861655950370_1405914999478356,Nakon ovog više nikad nećete gledati na peciva na isti način.,VIDEO Ashley Graham skinula se u toples i snimila čudni video s kruhom,link,http://www.index.hr/black/clanak/video-ashley-graham-skinula-se-u-toples-i-snimila-cudni-video-s-kruhom/958871.aspx,2017-03-24 04:59:50,13,4,0,12,0,1,0,0,0
107861655950370_1405914972811692,,ZAGREB POD OPSADOM Policija je spremna i za tučnjave među hrvatskim navijačima,link,http://www.index.hr/sport/clanak/zagreb-pod-opsadom-policija-je-spremna-i-za-tucnjave-medu-hrvatskim-navijacima-/958870.aspx,2017-03-24 04:59:45,15,2,1,15,0,0,0,0,0
107861655950370_1405914929478363,Index Rouge: Spajaju se dvije moćne obitelji :),Vjenčanje o kojem bruji svijet šoubiznisa,link,http://www.index.hr/rouge/clanak/vjencanje-o-kojem-bruji-svijet-soubiznisa/958864.aspx,2017-03-24 04:59:40,21,1,0,21,0,0,0,0,0
107861655950370_1405914889478367,Index Vijesti: Obitelj moli da ih se pusti da tuguju na miru.,"Objavljena zadnja fotka policajca koji je ubijen u Londonu, snimljena je 45 minuta prije napada",link,http://www.index.hr/vijesti/clanak/objavljena-zadnja-fotka-policajca-koji-je-ubijen-u-londonu-snimljena-je-45-minuta-prije-napada/958875.aspx,2017-03-24 04:59:33,51,2,0,14,0,0,0,37,0
107861655950370_1405914849478371,"Index Fit: Osim što noge čine stupastima, iza njih se može skrivati i neki ozbiljniji problem",Kako se riješiti debelih gležnjeva?,link,http://www.index.hr/fit/clanak/kako-se-rijesiti-debelih-gleznjeva/796745.aspx,2017-03-24 04:59:27,6,3,1,6,0,0,0,0,0
107861655950370_1405914809478375,"Index Auto: Ima preko 400 KS, a pojuri gotovo 300 km/h","FOTO: Ovo je najjači, najbrži, i najskuplji Fiat 500 u povijesti",link,http://www.index.hr/auto/clanak/foto-ovo-je-najjaci-najbrzi-i-najskuplji-fiat-500-u-povijesti/958881.aspx,2017-03-24 04:59:22,161,12,6,158,0,2,0,0,1
107861655950370_1405914652811724,,"Srpski zajebant za povijest: Dobio je slobodno bacanje i umjesto penala, pogodio ovo",link,http://www.index.hr/sport/clanak/srpski-zajebant-za-povijest-dobio-je-slobodno-bacanje-i-umjesto-penala-pogodio-ovo/958874.aspx,2017-03-24 04:59:17,25,0,1,21,0,0,4,0,0
107861655950370_1405914542811735,Index Vijesti: Što bi mi dali za ovakve dnevnice?,Djeca u Norveškoj režu jezike bakalara za dnevnicu veću od 3.500 kuna,link,http://www.index.hr/vijesti/clanak/djeca-u-norveskoj-rezu-jezike-bakalara-za-dnevnicu-vecu-od-3500-kuna/958877.aspx,2017-03-24 04:59:11,1281,141,124,1194,13,46,19,3,6
107861655950370_1405893376147185,Index Vijesti: Policija je već ispitala 3500 svjedoka i trenutno pregledavaju 2700 zaplijenjenih predmeta.,Uhićeno još dvoje povezanih s terorističkim napadom u Londonu,link,http://www.index.hr/vijesti/clanak/uhiceno-jos-dvoje-povezanih-s-terorizmom-u-londonu-objavljeno-izvorno-ime-napadaca/958869.aspx,2017-03-24 04:21:55,4,0,0,4,0,0,0,0,0
107861655950370_1405893262813863,Index Sport: Nezaustavljiv je,Bosanska zvijer double-doubleom sredila Knickse,link,http://www.index.hr/sport/clanak/bosanska-zvijer-doubledoubleom-sredila-knickse/958846.aspx,2017-03-24 04:21:48,21,0,0,18,3,0,0,0,0
107861655950370_1405893262813863,Index Sport: Nezaustavljiv je,Bosanska zvijer double-doubleom sredila Knickse,link,http://www.index.hr/sport/clanak/bosanska-zvijer-doubledoubleom-sredila-knickse/958846.aspx,2017-03-24 04:21:48,21,0,0,18,3,0,0,0,0
107861655950370_1405893169480539,,BRUTALNE GOLGETERSKE BROJKE Zašto je Buenos Aires ukazanje najboljeg na svijetu pozdravio kao Boga,link,http://www.index.hr/sport/clanak/brutalne-golgeterske-brojke-zasto-je-buenos-aires-ukazanje-najboljeg-na-svijetu-pozdravio-kao-boga/958847.aspx,2017-03-24 04:21:45,8,0,0,7,1,0,0,0,0
107861655950370_1405893146147208,Mali genijalac.,"VIDEO Četverogodišnjak spasio mamin život, a način iznenadio čak i spasitelje",link,http://www.index.hr/black/clanak/video-cetverogodisnjak-spasio-mamin-zivot-a-nacin-iznenadio-cak-i-spasitelje/958828.aspx,2017-03-24 04:21:42,294,5,7,260,29,5,0,0,0
107861655950370_1405893079480548,Index Auto: Porsche u ovoj godini planira pravu ekskluzivu,VIDEO Porsche najavio ekskluzivni 911,link,http://www.index.hr/auto/clanak/video-porsche-najavio-ekskluzivni-911/958707.aspx,2017-03-24 04:21:34,2,0,2,2,0,0,0,0,0
107861655950370_1405893006147222,Index Mame: Svaka čast ovakvim učiteljicama,Još jedan odličan primjer dobre školske prakse,link,http://www.index.hr/mame/clanak/jos-jedan-odlican-primjer-dobre-skolske-prakse/958872.aspx,2017-03-24 04:21:29,10,0,1,9,1,0,0,0,0
107861655950370_1405892986147224,Index Auto: Novi SUV model će biti najprestižniji u gami španjolskog proizvođača,Seat u SUV ofenzivi: Potvrđen i treći model,link,http://www.index.hr/auto/clanak/seat-u-suv-ofenzivi-potvrden-i-treci-model/958688.aspx,2017-03-24 04:21:25,2,0,0,2,0,0,0,0,0
107861655950370_1405892949480561,Index Rouge: Samo to možda ne primjećuješ :/,5 znakova da imaš užasnog dečka,link,http://www.index.hr/rouge/clanak/5-znakova-da-imas-uzasnog-decka/958854.aspx,2017-03-24 04:21:19,39,6,4,39,0,0,0,0,0
107861655950370_1405892929480563,,Messijeva osveta suparniku koji mu je zgadio Argentinu,link,http://www.index.hr/sport/clanak/messijeva-osveta-suparniku-koji-mu-je-zgadio-argentinu/958836.aspx,2017-03-24 04:21:16,42,1,0,40,1,0,1,0,0
107861655950370_1405892899480566,,MAKSIMIR OD SRBIJE NE PAMTI OVAKVU NAVALU Još možete nabaviti kartu za Hrvatsku!,link,http://www.index.hr/sport/clanak/maksimir-od-srbije-ne-pamti-ovakvu-navalu-jos-mozete-nabaviti-kartu-za-hrvatsku-/958857.aspx,2017-03-24 04:21:13,76,3,0,74,2,0,0,0,0
107861655950370_1405892859480570,Index Vijesti: U automobilu su bili Carlos Cortez (2) i Jayden Cortez (1).,"Dadilja ""na trenutak"" ostavila dvoje male djece u autu, u tijeku je potjera za otmičarom",link,http://www.index.hr/vijesti/clanak/dadilja-na-trenutak-ostavila-dvoje-male-djece-u-autu-u-tijeku-je-potjera-za-otmicarom/958844.aspx,2017-03-24 04:21:08,3,0,0,2,0,0,0,1,0
107861655950370_1405892836147239,,BRAZIL OPET STRAH I TREPET Marš prema Rusiji nastavio Neymarovim lobom i Paulinhovom bombom,link,http://www.index.hr/sport/clanak/brazil-opet-strah-i-trepet-mars-prema-rusiji-nastavio-neymarovim-lobom-i-paulinhovom-bombom/958860.aspx,2017-03-24 04:21:05,10,0,0,10,0,0,0,0,0
107861655950370_1405892809480575,"Nikad nemojte ovo raditi, ali stvarno!",Žene otkrile: Ove četiri stvari ne podnosimo kod muškaraca,link,http://www.index.hr/black/clanak/zene-otkrile-ove-cetiri-stvari-ne-podnosimo-kod-muskaraca/958863.aspx,2017-03-24 04:21:02,19,1,0,19,0,0,0,0,0
107861655950370_1405892736147249,Index Mame: I plač nestane u sekundi!,Genijalan trik jednog tate: kako smiriti uplakanu bebu dok mame nema,link,http://www.index.hr/mame/clanak/genijalan-trik-jednog-tate-kako-smiriti-uplakanu-bebu-dok-mame-nema-/958855.aspx,2017-03-24 04:20:57,135,7,9,121,13,0,0,1,0
107861655950370_1405892702813919,Index Vijesti: Kerum napao Oparu SMS-om uvrijeđen što je rekao da su mu radnici ostali bez posla,"Kerum podivljao zbog Opare: Lažeš, ovršit ću ti polovni Hyundai",link,http://www.index.hr/vijesti/clanak/kerum-podivljao-zbog-opare-lazes-ovrsit-cu-ti-polovni-hyundai/958865.aspx,2017-03-24 04:20:52,41,12,1,17,2,0,22,0,0
107861655950370_1405892632813926,Index Vijesti: Patetična Karamarkova objava nema veze s onim što je donedavno promovirao,"Karamarko se u Izraelu zgražava nad fašizmom, a donedavno se družio s neonacistom",link,http://www.index.hr/vijesti/clanak/karamarko-se-u-izraelu-zgrazava-nad-fasizmom-a-donedavno-se-druzio-s-neonacistom/958856.aspx,2017-03-24 04:20:46,275,121,22,123,3,6,99,7,37
107861655950370_1405892609480595,Index Vijesti: Komentirao je i nedavni neonacistički marš po centru Zagreba,"Američka lekcija Plenkoviću zbog ploče u Jasenovcu: ""Teško je gledati te simbole""",link,http://www.index.hr/vijesti/clanak/americka-lekcija-plenkovicu-zbog-ploce-u-jasenovcu-tesko-je-gledati-te-simbole/958841.aspx,2017-03-24 04:20:41,111,54,20,78,7,4,18,2,2
107861655950370_1405892582813931,"Index Fit: Zato i mi slušamo njihov savjet te predstavljamo samo jednu, po njima najbolju vježbu za područje struka",Treneri se kunu - ovo je najbolja vježba za uži struk,link,http://www.index.hr/fit/clanak/treneri-se-kunu--ovo-je-najbolja-vjezba-za-uzi-struk-/958861.aspx,2017-03-24 04:20:36,168,8,69,162,6,0,0,0,0
107861655950370_1405892556147267,"Taman kad je mislila da je sve loše iza nje, ovo se dogodilo.","Procurila bizarna seks snimka Britney Spears: ""Opet će doživjeti živčani slom""",link,http://www.index.hr/black/clanak/procurila-bizarna-seks-snimka-britney-spears-opet-ce-dozivjeti-zivcani-slom/958858.aspx,2017-03-24 04:20:33,39,11,2,35,1,1,1,1,0
107861655950370_1405874959482360,Index Vijesti: Jeste li ih vidjeli?,FOTO Što Konzum pokušava poručiti plakatima kojima su oblijepili grad?,link,http://www.index.hr/vijesti/clanak/foto-sto-konzum-pokusava-poruciti-plakatima-kojima-su-oblijepili-grad/958853.aspx,2017-03-24 03:43:29,57,69,5,22,0,1,21,0,13
107861655950370_1405856306150892,"Da, daleko bolje :)",Daleko bolje: Grafički dizajner napravio urnebesni logo za Zračnu luku i postao hit na internetu,link,http://www.index.hr/black/clanak/daleko-bolje-graficki-dizajner-napravio-urnebesni-logo-za-zracnu-luku-i-postao-hit-na-internetu/958840.aspx,2017-03-24 03:06:42,768,42,58,572,17,0,174,3,2
107861655950370_1405828252820364,,Lajk.hr,link,http://www.index.hr/lajk/poster/185134/znate-li-kako-u-velikim-restoranima-peru-sude-ovaj-majstor-rijesi-stotine-tanjura-u-minuti,2017-03-24 02:30:00,46,7,0,44,0,2,0,0,0
107861655950370_1405470926189430,"Ne samo da su na Index Oglasima svi oglasi besplatni, već ćemo neke i promovirati za vas - baš poput ovog vrhunskog Passata ;)",Index Oglasi,link,http://www.index.hr/oglasi/vw-passat-cc-2-0-tdi/oid/456583?utm_source=facebook&utm_medium=social&utm_campaign=facebook_objava_m&utm_content=456583,2017-03-24 02:00:00,11,1,0,11,0,0,0,0,0
107861655950370_1405793856157137,Index Vijesti: Crna Gora ulazi u NATO?,Američki Senat idućeg tjedna glasa o ulasku Crne Gore u NATO,link,http://www.index.hr/vijesti/clanak/americki-senat-iduceg-tjedna-glasa-o-ulasku-crne-gore-u-nato/958832.aspx,2017-03-24 01:37:51,15,9,0,14,1,0,0,0,0
107861655950370_1405721816164341,Index Vijesti: Jure Šundov zasad je sačuvao 194 tisuća kuna koje traži Promet.,"Kerumov zamjenik dobio Promet: Platili su iako su znali da ne moraju, sada ne mogu tražiti novac nazad",link,http://www.index.hr/vijesti/clanak/kerumov-zamjenik-dobio-promet-platili-su-iako-su-znali-da-ne-moraju-sada-ne-mogu-traziti-novac-nazad/958808.aspx,2017-03-23 23:30:08,9,0,0,9,0,0,0,0,0
107861655950370_1405700729499783,,"""Ja ću tamo biti sitna riba"": Ciganović uskoro u bizarnom američkom reality showu",link,http://www.index.hr/black/clanak/ja-cu-tamo-biti-sitna-riba-ciganovic-uskoro-u-bizarnom-americkom-reality-showu/910670.aspx,2017-03-23 22:53:08,141,90,4,110,1,0,22,6,2
107861655950370_1405612949508561,Index Auto: Hoće li Golf biti opet najprodavaniji auto u Hrvatskoj?,"Novi Golf u prodaji, evo koliko ćete ga platiti",link,http://www.index.hr/auto/clanak/novi-golf-u-prodaji-evo-koliko-cete-ga-platiti/956551.aspx,2017-03-23 20:28:31,49,10,2,48,1,0,0,0,0
107861655950370_1405558136180709,"Index Mame: Ona ne prestaje, ona toliko iscrpljuje, a lijeka praktički da i nema.",Trudnoća s dijagnozom Hyperemesis Gravidarum stvarno je pravi pakao,link,http://www.index.hr/mame/clanak/trudnoca-s-dijagnozom-hyperemesis-gravidarum-stvarno-je-pravi-pakao-/957038.aspx,2017-03-23 19:00:18,4,0,1,4,0,0,0,0,0
107861655950370_1405558076180715,Index Mame: Od tog razgovora kojeg je potaknulo sinovo pitanje mi smo shvatili da ovako više ne možemo,Rečenica kojom je sin spasio naš brak,link,http://www.index.hr/mame/clanak/recenica-kojom-je-sin-spasio-nas-brak-/856125.aspx,2017-03-23 19:00:13,113,0,6,110,3,0,0,0,0
107861655950370_1405535856182937,Index Vijesti: Samo ove godine oko 560 migranata poginulo ili nestalo na putu do Italije,"Izvlače se tijela migranata iz Sredozemnog mora, moglo bi biti više od 200 mrtvih",link,http://www.index.hr/vijesti/clanak/izvlace-se-tijela-migranata-iz-sredozemnog-mora-moglo-bi-biti-vise-od-200-mrtvih/958818.aspx,2017-03-23 18:22:50,28,11,1,9,1,0,0,18,0
107861655950370_1405509439518912,"Index Vijesti: Jednom je prilikom liberalnu židovsku grupu nazvao ""gorom od Židova koji su pomagali nacistima da zatvore druge Židove u holokaustu"".",Izjavio da su liberalni Židovi gori od nacista pa izabran za američkog ambasadora u Izraelu,link,http://www.index.hr/vijesti/clanak/-izjavio-da-su-liberalni-zidovi-gori-od-nacista-pa-izabran-za-americkog-ambasadora-u-izraelu/958824.aspx,2017-03-23 17:45:26,7,1,0,7,0,0,0,0,0
107861655950370_1405509372852252,Index Sport: U najmanju ruku - zanimljivo,"Chelseajeva legenda šokirala: ""Kanté? Nit je neki tehničar, nit je neki vođa""",link,http://www.index.hr/sport/clanak/chelseajeva-legenda-sokirala-kant-nit-je-neki-tehnicar-nit-je-neki-voda/958825.aspx,2017-03-23 17:45:19,39,4,1,38,0,0,1,0,0
107861655950370_1405509336185589,"Kaže da je ""tisuću puta sretniji.""","Godinu dana nije okusio ni kapi alkohola, ljudi oduševljeni promjenom koja mu se dogodila",link,http://www.index.hr/black/clanak/godinu-dana-nije-okusio-ni-kapi-alkohola-ljudi-odusevljeni-promjenom-koja-mu-se-dogodila/958829.aspx,2017-03-23 17:45:16,183,32,10,178,2,1,2,0,0
107861655950370_1405509296185593,Mora da su poludjeli...,"Natjecatelji realityja vratili se u civilizaciju, nisu znali da je show otkazan prije 7 mjeseci",link,http://www.index.hr/black/clanak/natjecatelji-realityja-vratili-se-u-civilizaciju-nisu-znali-da-je-show-otkazan-prije-7-mjeseci/958830.aspx,2017-03-23 17:45:11,331,15,6,227,5,20,76,1,2
107861655950370_1405481656188357,"Index Vijesti: ""Bio je potpuno antisocijalan, neprilagođen je preslaba riječ""","Njujorški rasistički ubojica bio je ""gubitnik i luđak koji je na Božić trčao okolo gol""",link,http://www.index.hr/vijesti/clanak/-njujorski-rasisticki-ubojica-bio-je-gubitnik-i-ludak-koji-je-na-bozic-trcao-okolo-gol/958812.aspx,2017-03-23 17:07:36,4,3,0,4,0,0,0,0,0
107861655950370_1405481546188368,Index Sport: Utopija ili odlična ideja?,Navijač pokreće kampanju prikupljanja milijarde eura da otkupi Arsenal od američkih vlasnika,link,http://www.index.hr/sport/clanak/navijac-pokrece-kampanju-prikupljanja-milijarde-eura-da-otkupi-arsenal-od-americkih-vlasnika/958822.aspx,2017-03-23 17:07:28,13,1,0,10,0,0,3,0,0
107861655950370_1405481492855040,Index Sport: Pamtimo i bolje dane,Je li ovo najdosadnije kolo kvalifikacija?,link,http://www.index.hr/sport/clanak/je-li-ovo-najdosadnije-kolo-kvalifikacija/958801.aspx,2017-03-23 17:07:24,25,0,1,25,0,0,0,0,0
107861655950370_1405481442855045,Index Vijesti: 500 kuna globe u Splitu za ispijanje alkohola na javnoj površini.,Baldasar želi zabraniti pivo ekipi sa zidića: U Splitu globe od 500 kuna za alkohol na javnoj površini,link,http://www.index.hr/vijesti/clanak/baldasar-zeli-zabraniti-pivo-ekipi-sa-zidica-u-splitu-globe-od-500-kuna-za-alkohol-na-javnoj-povrsini-/958821.aspx,2017-03-23 17:07:19,111,55,3,65,4,0,17,4,21
107861655950370_1405481386188384,"Index Sport: AKO IDETE NA UTAKMICU, OVO JE BITNO ZNATI","Policija u strahu od nereda okupirala Zagreb, evo kako će se pregledavati navijači",link,http://www.index.hr/sport/clanak/policija-u-strahu-od-nereda-okupirala-zagreb-evo-kako-ce-se-pregledavati-navijaci/958815.aspx,2017-03-23 17:07:14,57,26,2,50,1,0,5,1,0
107861655950370_1405481369521719,Iznenađeni?,Napokon znamo tip muškog tijela za kojim žene sline na porno stranicama,link,http://www.index.hr/black/clanak/napokon-znamo-tip-muskog-tijela-za-kojim-zene-sline-na-porno-stranicama/958813.aspx,2017-03-23 17:07:11,20,6,1,19,0,1,0,0,0
107861655950370_1405481296188393,Pa što je ovo :D :D,"VIDEO Planina golih ljudi i ""čovjek-vagina"": Teško ćete danas vidjeti bizarniju snimku od ove (18+)",link,http://www.index.hr/black/clanak/video-planina-golih-ljudi-i-covjekvagina-tesko-cete-danas-vidjeti-bizarniju-snimku-od-ove-18/958816.aspx,2017-03-23 17:07:08,35,2,2,33,0,1,1,0,0
107861655950370_1405481206188402,"Index Sport: Trenera Hajduka usporedio je s političarima...

Otkrio je i za koga navija u HNL-u, zašto skida kapu Mamiću i što misli o regionalnoj ligi.","Jeličić odgovorio Carrillu i ispričao se ""Plivariću""",link,http://www.index.hr/sport/clanak/jelicic-odgovorio-carrillu-i-ispricao-se-plivaricu/958811.aspx,2017-03-23 17:07:02,30,5,0,30,0,0,0,0,0
107861655950370_1405481119521744,Index Ljubimci: Kako spava vaš pas? :),Ovih šest položaja u kojima vaš psić spava otkrivaju zanimljive stvari o vašem ljubimcu,link,http://www.index.hr/ljubimci/clanak/ovih-sest-polozaja-u-kojima-vas-psic-spava-otkrivaju-zanimljive-stvari-o-vasem-ljubimcu/958810.aspx,2017-03-23 17:06:57,213,19,17,205,7,1,0,0,0
107861655950370_1405481059521750,"Index Sport: Vjerojatno nećete pogoditi...

A jedan klub iz Hrvatske je po tome daleko najbolji na ovim prostorima...",Samo jedan klub u Europi je imao pun stadion na svim utakmicama,link,http://www.index.hr/sport/clanak/samo-jedan-klub-u-europi-je-imao-pun-stadion-na-svim-utakmicama/958820.aspx,2017-03-23 17:06:52,77,15,6,69,1,1,6,0,0
107861655950370_1405427872860402,,Lajk.hr,link,http://www.index.hr/lajk/poster/185143/htjele-su-se-uljepsati-ali-su-od-svog-tijela-napravile-pravu-katastrofu,2017-03-23 16:30:00,51,54,0,20,0,5,13,10,3
107861655950370_1405419402861249,Index Sport: Bravo!,Teška pobjeda Borne Ćorića nakon medicinskog tretmana i preokreta,link,http://www.index.hr/sport/clanak/teska-pobjeda-borne-corica-nakon-medicinskog-tretmana-i-preokreta/958806.aspx,2017-03-23 15:47:25,19,0,0,18,1,0,0,0,0
107861655950370_1405419349527921,"Index Vijesti: ""Nažalost, u Bibliji je Bog nekoliko puta koristio takve situacije"".","Republikanac izjavio da su silovanje i incest dio ""Božje volje""",link,http://www.index.hr/vijesti/clanak/republikanac-izjavio-da-su-silovanje-i-incest-dio-bozje-volje/958797.aspx,2017-03-23 15:47:20,31,20,0,3,0,0,1,1,26
107861655950370_1405418886194634,Index Sport: Nevjerojatan meč.,Pogledajte kako je Džumhur poludio na suca pa spasio pet meč-lopti,link,http://www.index.hr/sport/clanak/pogledajte-kako-je-djumhur-poludio-na-suca-pa-spasio-pet-meclopti/958804.aspx,2017-03-23 15:47:12,14,0,0,14,0,0,0,0,0
107861655950370_1405418839527972,"""Bolje ilegalno živ, nego legalno mrtav.""","Student izliječen uljem kanabisa: ""Ako sam ja najveći problem u BiH, nek´ me sutra uhapse""",link,http://www.index.hr/black/clanak/student-izlijecen-uljem-kanabisa-ako-sam-ja-najveci-problem-u-bih-nek-me-sutra-uhapse/958783.aspx,2017-03-23 15:47:09,2205,23,100,2126,66,7,4,1,1
107861655950370_1405418802861309,Neno je ispričao nikad ispričanu priču.,Neno Belan otkrio kako je Ella Dvornik dobila ime,link,http://www.index.hr/black/clanak/neno-belan-otkrio-kako-je-ella-dvornik-dobila-ime/958795.aspx,2017-03-23 15:47:05,247,13,1,241,6,0,0,0,0
107861655950370_1405390366197486,Index Sport: Sviđa li vam se?,Procurio novi Barcelonin dres s dvije velike promjene,link,http://www.index.hr/sport/clanak/procurio-novi-barcelonin-dres-s-dvije-velike-promjene/958760.aspx,2017-03-23 15:09:41,33,5,0,33,0,0,0,0,0
107861655950370_1405390322864157,"Odlučila je postati muškarac, pa rodila dijete.","Transrodni muškarac rodio kćerkicu: ""Sreća da u obitelji imamo dvije maternice""",link,http://www.index.hr/black/clanak/transrodni-muskarac-rodio-kcerkicu-sreca-da-u-obitelji-imamo-dvije-maternice/958777.aspx,2017-03-23 15:09:37,38,32,3,22,7,0,2,1,6
107861655950370_1405390219530834,"Index Sport: Ispisali povijest, ali i zaradili kazne.","Barcelona kažnjena zbog ponašanja navijača, ali i igrača protiv PSG-a",link,http://www.index.hr/sport/clanak/barcelona-kaznjena-zbog-ponasanja-navijaca-ali-i-igraca-protiv-psga/958786.aspx,2017-03-23 15:09:32,13,1,0,13,0,0,0,0,0
107861655950370_1405390149530841,Index Sport: Ukrajincima je otkrio i kako Dinamo stvara silne talente.,"Modrićeva treća sreća: ""Nadam se da će se to konačno promijeniti""",link,http://www.index.hr/sport/clanak/modriceva-treca-sreca-nadam-se-da-ce-se-to-konacno-promijeniti/958796.aspx,2017-03-23 15:09:27,17,2,0,17,0,0,0,0,0
107861655950370_1405390112864178,Nije očekivao da će pristati :D,"FOTO Mladom golferu palice će nositi Playboyeva zečica, ima samo jedan uvjet: ""U što sam se uvalio""",link,http://www.index.hr/black/clanak/foto-mladom-golferu-palice-ce-nositi-playboyeva-zecica-ima-samo-jedan-uvjet-u-sto-sam-se-uvalio/958751.aspx,2017-03-23 15:09:23,30,0,0,29,1,0,0,0,0
107861655950370_1405390036197519,Index Vijesti: U utorak je priznala policiji da je sve izmislila i da si je sama nanijela ozljede.,Tinejdžerka izmislila i prijavila policiji da su ju otela i silovala trojica Afroamerikanaca,link,http://www.index.hr/vijesti/clanak/tinejdjerka-izmislila-i-prijavila-policiji-da-su-ju-otela-i-silovala-trojica-afroamerikanaca/958790.aspx,2017-03-23 15:09:17,7,3,0,4,0,0,1,2,0
107861655950370_1405389956197527,Index Rouge: Po ovome bi definitivno trebalo živjeti ;),90/10: Pravilo koje vam garantira životnu sreću,link,http://www.index.hr/rouge/clanak/9010-pravilo-koje-vam-garantira-zivotnu-srecu/958743.aspx,2017-03-23 15:09:12,8,0,0,8,0,0,0,0,0
107861655950370_1405389859530870,,"Ćorić, Bašić i Murić sredili Slovence u prijateljskoj utakmici U-21 reprezentacija",link,http://www.index.hr/sport/clanak/coric-basic-i-muric-sredili-slovence-u-prijateljskoj-utakmici-u21-reprezentacija/958781.aspx,2017-03-23 15:09:05,7,1,0,7,0,0,0,0,0
107861655950370_1405389786197544,"Index Fit: Muškarci i žene odlaze na trening potaknuti različitim motivima, no imaju i nešto što im je zajedničko, a to je želja za uskim strukom i dobro mišićno izgrađenim trbuhom",4-minutni trening trbuha za žene i muškarce,link,http://www.index.hr/fit/clanak/4minutni-trening-trbuha-za-zene-i-muskarce/895330.aspx,2017-03-23 15:09:00,16,0,10,16,0,0,0,0,0
107861655950370_1405389742864215,Index Ljubimci: Vlasnici mačaka će prepoznati bar nešto od ovoga. :D <3,"Svi mi volimo mace, no nekada znaju biti jako, jako čudne",link,http://www.index.hr/ljubimci/clanak/svi-mi-volimo-mace-no-nekada-znaju-biti-jako-jako-cudne/958759.aspx,2017-03-23 15:08:55,83,6,7,74,5,0,4,0,0
107861655950370_1405389666197556,Index Sport: Bio bi to svjetski rekord.,"Mourinho je za svjetsku senzaciju ponudio rekordnih 110 milijuna eura, a dobio je samo ekspresnu odbijenicu",link,http://www.index.hr/sport/clanak/mourinho-je-za-svjetsku-senzaciju-ponudio-rekordnih-110-milijuna-eura-i-dobio-ekspresnu-odbijenicu/958773.aspx,2017-03-23 15:08:50,11,2,0,11,0,0,0,0,0
107861655950370_1405389596197563,"Index Vijesti: Nedrkovi savjeti najviše su se cijenili u ovoj Vladi, a savjetnici pri Vladi zarade i do 150 tisuća kuna mjesečno. Stvarni iznosi puno su veći.","Pogledajte koliko plaćamo savjetnike u vladi: Gotovina radi besplatno, a najskuplji je bio Ilčić",link,http://www.index.hr/vijesti/clanak/pogledajte-koliko-placamo-savjetnike-u-vladi-gotovina-radi-besplatno-a-najskuplji-je-bio-ilcic/958630.aspx,2017-03-23 15:08:44,92,34,15,43,0,5,13,3,28
107861655950370_1405389569530899,Wooooooooooooooooooow!,FOTO Čudo arhitekture: Evo kako će izgledati najveći neboder na svijetu,link,http://www.index.hr/black/clanak/foto-cudo-arhitekture-u-obliku-slova-u-evo-kako-ce-izgledati-najveci-neboder-na-svijetu/958785.aspx,2017-03-23 15:08:41,44,4,0,42,0,1,1,0,0
107861655950370_1405389522864237,Index Fit: Iznenadite svoje frajere nakon što ojačate taman gdje trebate,6 vježbi za puno bolji seks,link,http://www.index.hr/fit/clanak/6-vjezbi-za-puno-bolji-seks-/958713.aspx,2017-03-23 15:08:36,18,7,5,18,0,0,0,0,0
