status_id,status_message,link_name,status_type,status_link,status_published,num_reactions,num_comments,num_shares,num_likes,num_loves,num_wows,num_hahas,num_sads,num_angrys
107861655950370_1407207702682419,"Vaši statusi na Faceu, Instagramu i Twitteru o vama govori više nego što mislite.",Jeste li među njima? Evo što na Facebooku objavljuju nesigurni ljudi,link,http://www.index.hr/black/clanak/jeste-li-medu-njima-evo-sto-na-facebooku-objavljuju-nesigurni-ljudi/959170.aspx,2017-03-25 12:40:19,121,15,18,109,0,3,8,0,1
107861655950370_1407207639349092,Index Rouge: Ne znamo koja nam je ljepša :),"Pronašle smo tri ""kožne"" jakne za dvjestotinjak kuna",link,http://www.index.hr/rouge/clanak/pronasle-smo-tri-kozne-jakne-za-dvjestotinjak-kuna-/959184.aspx,2017-03-25 12:40:14,32,7,0,31,0,1,0,0,0
107861655950370_1407207589349097,Index Vijesti: Tursku više ne zanima članstvo u EU?,"Erdogan: Ne daju nam u EU zbog smrtne kazne? Neka, olakšat će nam posao",link,http://www.index.hr/vijesti/clanak/erdogan-ne-daju-nam-u-eu-zbog-smrtne-kazne-neka-olaksat-ce-nam-posao/959189.aspx,2017-03-25 12:40:09,30,28,0,24,0,0,5,0,1
107861655950370_1407207522682437,"Index Vijesti: Šutio je par sati, pa krenuo u protunapad na Twitteru","Trump je šutio par sati nakon velikog poraza, a onda najavio ""eksploziju"" na Twitteru",link,http://www.index.hr/vijesti/clanak/trump-je-sutio-par-sati-nakon-velikog-poraza-a-onda-najavio-eksploziju-na-twitteru/959187.aspx,2017-03-25 12:40:03,5,7,0,4,0,1,0,0,0
107861655950370_1407207436015779,Index Sport: Svi žele novog Buffona!,"VELIKANI, PAŽNJA Berlusconi progovorio o budućnosti Milanovog fenomena",link,http://www.index.hr/sport/clanak/velikani-paznja-berlusconi-progovorio-o-buducnosti-milanovog-fenomena/959175.aspx,2017-03-25 12:39:59,76,0,1,73,3,0,0,0,0
107861655950370_1407207362682453,"Index Vijesti: ""Kada bi ona počela spašavati Zagrebački Holding, onda bi mi morali kupiti prnje iz grada Zagreba.""",Bandić o Lex Todoriću: Ne daj bog da nam Dalićka spašava Holding,link,http://www.index.hr/vijesti/clanak/bandic-o-lex-todoricu-ne-daj-bog-da-nas-dalicka-spasava/959181.aspx,2017-03-25 12:39:53,133,39,12,89,1,0,39,0,4
107861655950370_1407207306015792,Susjedi se izlajali o svemu.,"Ivanka je susjeda iz pakla: ""Otkako se doselila ovdje je stalno neki cirkus""",link,http://www.index.hr/black/clanak/ivanka-je-susjeda-iz-pakla-otkako-se-doselila-ovdje-je-stalno-neki-cirkus/959179.aspx,2017-03-25 12:39:50,25,3,0,24,0,0,0,0,1
107861655950370_1407207226015800,Index Sport: Cijela Britanija priča o ovoj snimci zbog koje je velški nogometaš teško optužen,Snimka koje podigla Otok na noge: Je li moguće da se Velšanin zlobno smijao stravičnoj ozljedi Irca?,link,http://www.index.hr/sport/clanak/snimka-koje-podigla-otok-na-noge-je-li-moguce-da-se-velsanin-zlobno-smijao-stravicnoj-ozljedi-irca/959174.aspx,2017-03-25 12:39:45,39,3,1,35,2,0,1,0,1
107861655950370_1407207119349144,"Index Fit: Puno tekućine spriječit će glavobolje, potaknuti rad mozga, poboljšati raspoloženje i pomoći ti da se riješiš viška kilograma.",Niste još počeli? - 15 razloga zašto trebate piti vodu s limunom,link,http://www.index.hr/fit/clanak/niste-jos-poceli--15-razloga-zasto-trebate-piti-vodu-s-limunom/774558.aspx,2017-03-25 12:39:39,43,4,0,43,0,0,0,0,0
107861655950370_1407207086015814,"Da, jasno nam je zašto se priča o njoj.","Lindsey Vonn objavila fotku u bikiniju, a svi gledaju istu stvar",link,http://www.index.hr/black/clanak/lindsey-vonn-objavila-fotku-u-bikiniju-a-svi-gledaju-istu-stvar/959183.aspx,2017-03-25 12:39:36,241,13,1,234,4,0,1,1,1
107861655950370_1407206999349156,Index Vijesti: Turska je odjednom jako zainteresirana za srpsko-hrvatske tenzije.,"VIDEO Turska je preuzela Putinov model propagandnog rata, je li na meti i Hrvatska?",link,http://www.index.hr/vijesti/clanak/video-turska-je-preuzela-putinov-model-propagandnog-rata-je-li-na-meti-i-hrvatska/959164.aspx,2017-03-25 12:39:31,30,22,3,18,1,0,7,0,4
107861655950370_1406923426044180,Uskoro bivši vlasnik ovog Audija besplatno je predao oglas na Index Oglasima - baš kao i deseci tisuća drugih korisnika!,Index Oglasi,link,http://www.index.hr/oglasi/audi-a4-2-0-tdi-sport-line-navi/oid/456956?utm_source=facebook&utm_medium=social&utm_campaign=facebook_objava_mz&utm_content=456956,2017-03-25 12:00:04,13,1,0,13,0,0,0,0,0
107861655950370_1407143399355516,,Zvijezda New Yorka kažnjena s 20 utakmica bez plaće zbog dopinga,link,http://www.index.hr/sport/clanak/evo-kako-je-zvijezda-new-yorka-kaznjena-zbog-dopinga/959169.aspx,2017-03-25 11:09:52,18,0,0,15,2,0,1,0,0
107861655950370_1407143369355519,"Kod nas mu se i dalje podsmjehuju, a on organizira izložbe diljem svijeta.","Lupino: U New Yorku mi nude 200.000 dolara za skulpturu, ali ona vrijedi puno više",link,http://www.index.hr/black/clanak/lupinu-u-new-yorku-nude-200000-dolara-za-skulpturu-on-odbija-vrijedit-ce-ona-puno-vise/959165.aspx,2017-03-25 11:09:49,81,25,1,72,2,1,6,0,0
107861655950370_1407143322688857,Index Rouge: Iz svakog neuspjeha može se izvući pouka :),Stvari koje ćete sigurno požaliti u životu,link,http://www.index.hr/rouge/clanak/stvari-koje-cete-sigurno-pozaliti-u-zivotu/959123.aspx,2017-03-25 11:09:44,11,1,0,11,0,0,0,0,0
107861655950370_1407143249355531,Index Sport: Sramotne scene iz Palerma!,"Albanci divljali u Palermu i izazvali prekid, bijesni Talijani uzvratili pjesmom: ""Tko ne skače...""",link,http://www.index.hr/sport/clanak/albanci-divljali-u-palermu-i-izazvali-prekid-bijesni-talijani-uzvratili-pjesmom-tko-ne-skace/959167.aspx,2017-03-25 11:09:39,51,14,0,45,1,0,3,0,2
107861655950370_1407119156024607,Drama na Kustošiji,FOTO Muškarac u Zagrebu prijeti da će se raznijeti na balkonu,link,http://www.index.hr/vijesti/clanak/foto-muskarac-u-zagrebu-prijeti-da-ce-se-raznijeti-na-balkonu/959166.aspx,2017-03-25 10:30:53,33,53,2,25,3,4,1,0,0
107861655950370_1407116459358210,,ČOVJEK ZVANI REKORD Čudesni Buffon i njegova zlatna dostignuća,link,http://www.index.hr/sport/clanak/covjek-zvani-rekord-cudesni-buffon-i-njegova-zlatna-dostignuca/959161.aspx,2017-03-25 10:27:06,143,1,0,142,1,0,0,0,0
107861655950370_1407116412691548,Index Sport: Suigrači su ga u suzama tješili na travnjaku,Uznemirujuća snimka: Brutalnim uklizavanjem slomio nogu kapetanu Irske,link,http://www.index.hr/sport/clanak/uznemirujuca-snimka-brutalnim-uklizavanjem-slomio-nogu-kapetanu-irske/959142.aspx,2017-03-25 10:27:02,17,0,1,17,0,0,0,0,0
107861655950370_1407116336024889,Index Vijesti: 17-godišnjak pokušao pretjecati,SMRT U MEDARIMA Maloljetnik bez dozvole skrivio nesreću u kojoj mu je poginuo prijatelj,link,http://www.index.hr/vijesti/clanak/smrt-u-medarima-maloljetnik-bez-dozvole-skrivio-nesrecu-u-kojoj-mu-je-poginuo-prijatelj/959162.aspx,2017-03-25 10:26:56,54,7,4,38,0,0,0,14,2
107861655950370_1407116249358231,Index Vijesti: Žele ograničiti razvoj djeci i betonizirati zelenilo na Turskoj kuli,"VIDEO Prosvjed na Turskoj kuli u Splitu: ""Žele uništiti i ovo malo zelenila, tu se igraju djeca""",link,http://www.index.hr/vijesti/clanak/video-prosvjed-na-turskoj-kuli-u-splitu-zele-unistiti-i-ovo-malo-zelenila-tu-se-igraju-djeca/959145.aspx,2017-03-25 10:26:50,11,0,2,11,0,0,0,0,0
107861655950370_1407116206024902,Index Vijesti: Učinit će sve u svojoj moći da broj izbjeglica ostane konstantno nizak,Veliki zaokret stranke Angele Merkel: Izbjeglice više nisu dobrodošle u Njemačku,link,http://www.index.hr/vijesti/clanak/veliki-zaokret-stranke-angele-merkel-izbjeglice-vise-nisu-dobrodosle-u-njemacku/959157.aspx,2017-03-25 10:26:44,196,49,17,147,2,9,36,1,1
107861655950370_1407116102691579,Index Vijesti: Pogledajte kako je to izgledalo,"FOTO Šešeljevci marširali Beogradom, mahali četničkim zastavama i slikama Putina",link,http://www.index.hr/vijesti/clanak/foto-seseljevci-marsirali-beogradom-mahali-cetnickim-zastavama-i-slikama-putina/959163.aspx,2017-03-25 10:26:37,309,311,25,90,2,6,87,18,106
107861655950370_1407093962693793,,Barca poklanja Cruyffu spomenik ispred Camp Noua,link,http://www.index.hr/sport/clanak/barca-poklanja-cruyffu-spomenik-ispred-camp-noua/959160.aspx,2017-03-25 09:49:12,4,1,0,4,0,0,0,0,0
107861655950370_1407093906027132,Index Vijesti: Plenković je jedan od potpisnika dokumenta,Plenković potpisao Rimsku deklaraciju: Tekst je realan i ambiciozan,link,http://www.index.hr/vijesti/clanak/plenkovic-potpisao-rimsku-deklaraciju-tekst-je-realan-i-ambiciozan/959153.aspx,2017-03-25 09:49:07,15,13,0,7,0,0,5,0,3
107861655950370_1407093782693811,Index Vijesti: Kaže kako su ostvarili svoj cilj,Jedini zastupnik engleskih ekstremnih desničara napušta stranku,link,http://www.index.hr/vijesti/clanak/jedini-zastupnik-britanskih-desnih-populista-napusta-stranku/959156.aspx,2017-03-25 09:49:00,6,0,1,6,0,0,0,0,0
107861655950370_1407093626027160,A Željko je odustao od daljnjeg natjecanja.,"""Tri, dva, jedan - kuhaj!"": Sanja i Morena se vraćaju u show",link,http://www.index.hr/black/clanak/tri-dva-jedan--kuhaj-sanja-i-morena-se-vracaju-u-show/959154.aspx,2017-03-25 09:48:55,99,50,2,69,2,0,2,2,24
107861655950370_1407093542693835,"Index Mame: ""Konačno smo se ufurali. Ne bih to mogla bez suprugovih ruku. Ali smo ga savladali. Kakva je to sad magija!""",Konačno je naučila odraditi tandem i poručuje - ako vas ne zanima slobodno skrolajte dalje,link,http://www.index.hr/mame/clanak/konacno-je-naucila-odraditi-tandem-i-porucuje--ako-vas-ne-zanima-slobodno-skrolajte-dalje/959143.aspx,2017-03-25 09:48:49,23,0,0,19,4,0,0,0,0
107861655950370_1407093476027175,Index Rouge: Nećete joj moći odoljeti :),Svi žele ovu romantičnu košulju iz H&M-a,link,http://www.index.hr/rouge/clanak/svi-zele-ovu-romanticnu-kosulju-iz-hma/959118.aspx,2017-03-25 09:48:43,35,19,2,28,1,0,6,0,0
107861655950370_1407093409360515,Index Auto: Kakva zvijer!,VIDEO Najbrži na svijetu: Nissan GT-R je kralj utrka ubrzanja,link,http://www.index.hr/auto/clanak/video-najbrzi-na-svijetu-nissan-gtr-je-kralj-utrka-ubrzanja/958403.aspx,2017-03-25 09:48:37,624,26,17,602,12,10,0,0,0
107861655950370_1407093339360522,Jeste li znali da Lidija Bačić ima sestru? A još kad vam kažemo da i ona pjeva...,"Lidija Bačić pokazala sestru, teško je odlučiti koja je zgodnija",link,http://www.index.hr/black/clanak/lidija-bacic-pokazala-sestru-tesko-je-odluciti-koja-je-zgodnija/959151.aspx,2017-03-25 09:48:33,263,71,3,250,4,1,8,0,0
107861655950370_1407093316027191,Index Sport: Evo prave istine,NISU OTROVANI Evo zašto su nogometaši Osijeka i Želje završili u bolnici,link,http://www.index.hr/sport/clanak/nisu-otrovani-evo-zasto-su-nogometasi-osijeka-i-zelje-zavrsili-u-bolnici/959150.aspx,2017-03-25 09:48:30,21,2,0,21,0,0,0,0,0
107861655950370_1407093259360530,Index Sport: Sviđa li vam se ova ideja?,Novo pravilo će potpuno promijeniti ženski tenis,link,http://www.index.hr/sport/clanak/novo-pravilo-ce-potpuno-promijeniti-zenski-tenis/959155.aspx,2017-03-25 09:48:26,34,0,0,33,1,0,0,0,0
107861655950370_1407093229360533,Index Sport:: U Hrvatskoj mu je ljepše nego u Manchesteru,Mourinho otkrio zašto je došao u Zagreb,link,http://www.index.hr/sport/clanak/mourinho-otkrio-zasto-je-dosao-u-zagreb/959158.aspx,2017-03-25 09:48:22,75,0,0,75,0,0,0,0,0
107861655950370_1407067396029783,Index Vijesti: HNS i SDP zajedno izlaze na izbore u Zagrebu.,"Mrak Taritaš: ""Bandiću je završio rok trajanja""",link,http://www.index.hr/vijesti/clanak/mrak-taritas-bandicu-je-zavrsio-rok-trajanja/959136.aspx,2017-03-25 09:10:50,486,352,4,377,13,3,68,0,25
107861655950370_1407067376029785,Index Sport: Počela je nova sezona Formule 1!,Hamilton: Zasad savršen vikend,link,http://www.index.hr/sport/clanak/hamilton-zasad-savrsen-vikend/959129.aspx,2017-03-25 09:10:47,15,0,0,15,0,0,0,0,0
107861655950370_1407067339363122,Nives je objasnila otkud joj masnica.,"Nives Celzijus šokirala masnicom na oku: ""Svi me čudno i zgroženo gledaju""",link,http://www.index.hr/black/clanak/nives-celzijus-sokirala-masnicom-na-oku-svi-me-cudno-i-zgrozeno-gledaju/959125.aspx,2017-03-25 09:10:43,35,9,0,30,0,1,4,0,0
107861655950370_1407067282696461,Index Vijesti: Koriste civile kao štit,Iračke snage zaustavile napad u Mosulu jer je pobijeno previše civila,link,http://www.index.hr/vijesti/clanak/iracke-snage-zaustavile-napad-u-mosulu-jer-je-pobijeno-previse-civila/959127.aspx,2017-03-25 09:10:37,1,2,0,1,0,0,0,0,0
107861655950370_1407067239363132,Počinje nova emisija na RTL-u!,"Ovo su prvi kandidati RTL-ovog showa ""Superljudi""",link,http://www.index.hr/black/clanak/ovo-su-prvi-kandidati-rtlovog-showa-superljudi/959135.aspx,2017-03-25 09:10:33,7,0,0,7,0,0,0,0,0
107861655950370_1407067189363137,Index Vijesti: Trude se zadržati turiste što duže,U Vukovar doplovio prvi ovogodišnji kruzer,link,http://www.index.hr/vijesti/clanak/u-vukovar-doplovio-prvi-ovogodisnji-kruzer/959139.aspx,2017-03-25 09:10:28,66,0,0,66,0,0,0,0,0
107861655950370_1407067096029813,"Index Vijesti: Istina je da sam elementarna nepogoda, kaže Pernar","Pernar poslao poruku Saboru: ""Noćna sam mora za sve uhljebe""",link,http://www.index.hr/vijesti/clanak/pernar-poslao-poruku-saboru-nocna-sam-mora-za-sve-uhljebe/959141.aspx,2017-03-25 09:10:22,373,75,14,325,16,0,27,2,3
107861655950370_1407067062696483,Ovo ćete htjeti poslušati (a i pogledati).,VIDEO Gole grudi Chrissy Teigen progovorile: Poslušajte što imaju za reći,link,http://www.index.hr/black/clanak/video-gole-grudi-chrissy-teigen-progovorile-poslusajte-sto-kazu/959119.aspx,2017-03-25 09:10:18,23,2,0,20,0,0,2,1,0
107861655950370_1407067009363155,,"Isco progovorio o transferu u Barcelonu, Real mu nudi novi ugovor",link,http://www.index.hr/sport/clanak/isco-progovorio-o-transferu-u-barcelonu-real-mu-nudi-novi-ugovor/959107.aspx,2017-03-25 09:10:14,16,0,0,15,1,0,0,0,0
107861655950370_1407066962696493,Index Vijesti: SDP se protivi HDZ-ovom modelu spašavanja Agrokora.,"SDP o Agrokoru: ""Pozivamo Todorića da objasni javnosti kako misli riješiti problem""",link,http://www.index.hr/vijesti/clanak/sdp-protiv-zakona-o-agrokoru-neka-todoric-objasni-kako-misli-rijesiti-problem/959144.aspx,2017-03-25 09:10:08,294,76,17,264,15,2,11,1,1
107861655950370_1407066912696498,Index Rouge: Moramo priznati kako joj zavidimo ;),Poznata Hrvatica već danima izaziva ljubomoru na Instagramu,link,http://www.index.hr/rouge/clanak/poznata-hrvatica-vec-danima-izaziva-ljubomoru-na-instagramu/959109.aspx,2017-03-25 09:10:03,43,4,0,41,2,0,0,0,0
107861655950370_1407066859363170,"Index Mame: Ako vas je ikada zanimalo treba li dijete nekada ignorirati, treba li ih ušutkavati kada previše cendraju ili biti uvijek uz njih - bolje odgovore od ovih nećete dobiti",Mamica će uvijek popraviti stvar. Ma do kada?,link,http://www.index.hr/mame/clanak/mamica-ce-uvijek-popraviti-stvar-ma-do-kada-/901767.aspx,2017-03-25 09:09:57,92,5,11,89,3,0,0,0,0
107861655950370_1407066792696510,"Index Sport: Ako se ovaj transfer ostvari, postat će najskuplji hrvatski nogometaš ikada",INTER ODGOVORIO MOURINHU Perišić vrijedi barem 60 milijuna eura,link,http://www.index.hr/sport/clanak/inter-odgovorio-mourinhu-perisic-vrijedi-barem-60-milijuna-eura/959113.aspx,2017-03-25 09:09:52,272,5,2,260,7,0,5,0,0
107861655950370_1407066739363182,Index Vijesti: Obamin zakon o zdravstvu pokazao se kao tvrd orah za Trumpa.,"Trump je obećavao da će ukinuti i zamijeniti ""Obamacare"" prvi dan. Zašto nije uspio?",link,http://www.index.hr/vijesti/clanak/donald-trump-je-dozivio-najveci-poraz-dosad-a-sad-laze-o-tome/959138.aspx,2017-03-25 09:09:46,6,0,0,4,0,0,2,0,0
107861655950370_1407066676029855,Index Vijesti: Kaže kako je ovakvo uplitanje države napušteno čak i u Jugoslaviji,"SDP-ovac poručio: ""Nećeš spašavati Agrokor mojim novcem""",link,http://www.index.hr/vijesti/clanak/sdpovac-porucio-neces-spasavati-agrokor-mojim-novcem/959134.aspx,2017-03-25 09:09:39,1066,115,66,995,31,2,30,1,7
107861655950370_1407066626029860,"Index Fit: Ako pogledate iz jedne druge perspektive - hraniti se ionako morate, a vježbati možete i besplatno - onda to i nije neki izgovor zašto ste još uvijek malo veliki","5 žena otkriva kako su lako izgubile kilograme, bez puno truda i uloženog novca",link,http://www.index.hr/fit/clanak/5-zena-otkriva-kako-su-lako-izgubile-kilograme-bez-puno-truda-i-ulozenog-novca/959124.aspx,2017-03-25 09:09:34,25,0,2,25,0,0,0,0,0
107861655950370_1407066576029865,Index Rouge: Evo kako znati da frajer još ima osjećaje za svoju bivšu ;),5 stvari koje muškarci rade kad su još zaljubljeni u bivšu,link,http://www.index.hr/rouge/clanak/5-stvari-koje-muskarci-rade-kad-su-jos-zaljubljeni-u-bivsu/959116.aspx,2017-03-25 09:09:29,99,6,5,94,3,0,1,1,0
107861655950370_1407066552696534,Ima i lijepih priča iz javnog prijevoza :),"""Neznani junače iz busa 201 - hvala ti"": Putnik i vozač ZET-a zajedničkim snagama spasili večer",link,http://www.index.hr/black/clanak/neznani-junace-iz-busa-201--hvala-ti-putnik-i-vozac-zeta-zajednickim-snagama-spasili-vecer/959146.aspx,2017-03-25 09:09:26,604,10,22,575,29,0,0,0,0
107861655950370_1407066519363204,Pameline fotke iz mladosti se teško mogu pronaći.,"Pamela Anderson izjurila iz emisije jer su pokazali njenu staru fotku, evo kako je izgledala prije",link,http://www.index.hr/black/clanak/pamela-anderson-izjurila-iz-emisije-jer-su-pokazali-njenu-staru-fotku-evo-kako-je-izgledala-prije/959115.aspx,2017-03-25 09:09:22,37,4,0,32,3,1,1,0,0
107861655950370_1407066486029874,A gdje joj je Jose Armando? :P,"Sjećate se Esmeralde? Prošla je kroz pakao droge, evo kako danas živi i izgleda",link,http://www.index.hr/black/clanak/sjecate-se-esmeralde-prosla-je-kroz-pakao-droge-evo-kako-danas-zivi-i-izgleda/959128.aspx,2017-03-25 09:09:19,90,10,4,90,0,0,0,0,0
107861655950370_1406922849377571,"Kupujete ili prodajete, automobil, nekretninu ili nešto treće? Nemojte zaboraviti - Index Oglasi jedini su potpuno besplatan oglasnik u Hrvatskoj!",Index Oglasi,link,http://www.index.hr/oglasi/audi-a4-2-0-tdi-automatic/oid/456827?utm_source=facebook&utm_medium=social&utm_campaign=facebook_objava_mz&utm_content=456827,2017-03-25 08:30:01,8,1,0,8,0,0,0,0,0
107861655950370_1407026206033902,"Index Sport: Za Hrvatsku je uvijek igrao svim srcem, a sada igra najvažniju utakmicu života. Drži se, Ivane!",Potresne snimke s dijalize: Klasnić se bori s teškom bolešću,link,http://www.index.hr/sport/clanak/potresne-snimke-hrvatskog-golgetera-u-bolnickom-krevetu-zelim-opet-uzivati-u-zivotu/959131.aspx,2017-03-25 08:07:41,5247,167,89,3446,145,4,1,1642,9
107861655950370_1407002452702944,"Vlada ima vremena za spašavanje Todorića, a nema za blokirane građane.",Sudac Kolakušić o Lex Todorić: Ovo je prijelaz na tamnu stranu svjetske povijesti prava,link,http://www.index.hr/vijesti/clanak/sudac-kolakusic-o-lex-todoric-ovo-je-prijelaz-na-tamnu-stranu-svjetske-povijesti-prava-/959114.aspx,2017-03-25 07:44:01,1228,140,241,806,6,4,10,107,295
107861655950370_1406960746040448,,Lajk.hr,link,http://www.index.hr/lajk/poster/185212/ovako-danas-izgledaju-poznate-pop-i-rock-zvijezde-cije-smo-pjesme-slusali-prije-desetak-godina,2017-03-25 07:30:00,35,25,0,31,3,0,0,0,1
107861655950370_1406921372711052,Znate li da su Index Oglasi najbrže rastući oglasnik u Hrvatskoj? Provjerite zašto! :D,Index Oglasi,link,http://www.index.hr/oglasi/bmw-318d-modern-line-dynamicefficiency/oid/456714?utm_source=facebook&utm_medium=social&utm_campaign=facebook_objava_m&utm_content=456714,2017-03-25 07:00:00,5,0,0,5,0,0,0,0,0
107861655950370_1406925996043923,Nije se mogao suzdržati.,VIDEO Ed Sheeran strastveno poljubio popularnog komičara uživo na BBC-ju,link,http://www.index.hr/black/clanak/video-ed-sheeran-strastveno-poljubio-popularnog-komicara-uzivo-na-bbcju/959108.aspx,2017-03-25 06:26:38,9,9,0,9,0,0,0,0,0
107861655950370_1406925949377261,Index Vijesti: Osjetljivo pitanje oko brzine.,"Šefovi EU država potpisali Rimsku deklaraciju, jedna je riječ ipak bila sporna",link,http://www.index.hr/vijesti/clanak/sefovi-eu-drzava-potpisali-rimsku-deklaraciju-jedna-je-rijec-ipak-bila-sporna/959104.aspx,2017-03-25 06:26:32,5,0,0,5,0,0,0,0,0
107861655950370_1406925926043930,,Supruga Stipe Miočića fenomenalno objasnila što znači biti prvak,link,http://www.index.hr/sport/clanak/supruga-stipe-miocica-fenomenalno-objasnila-sto-znaci-biti-prvak-/959106.aspx,2017-03-25 06:26:30,29,0,0,28,1,0,0,0,0
107861655950370_1406925882710601,Index Fit: Kada najčešće jedete rajčice? A krumpir? Jabuku? Znate li kako određene namirnice djeluju na naš organizam ovisno o dobu dana u kojem ih pojedemo?,Najbolje i najgore vrijeme za pojedine namirnice,link,http://www.index.hr/fit/clanak/najbolje-i-najgore-vrijeme-za-pojedine-namirnice-/959112.aspx,2017-03-25 06:26:25,7,0,2,7,0,0,0,0,0
107861655950370_1406925736043949,Index Rouge: Znamo da i dalje vjerujete u njega ;),U ovaj mit morate prestati vjerovati,link,http://www.index.hr/rouge/clanak/u-ovaj-mit-morate-prestati-vjerovati/959102.aspx,2017-03-25 06:26:20,18,1,0,18,0,0,0,0,0
107861655950370_1406925609377295,Jednostavno se nije mogao pomiriti.,"Tek se sad zna koliko je zapravo nesretan bio brak Charlesa i Diane: ""On je plakao uoči vjenčanja""",link,http://www.index.hr/black/clanak/tek-se-sad-zna-koliko-je-zapravo-nesretan-bio-brak-charlesa-i-diane-on-je-plakao-uoci-vjencanja/959100.aspx,2017-03-25 06:26:17,146,61,2,106,4,3,8,24,1
107861655950370_1406925466043976,Index Vijesti: Molitelji tvrde da imaju pravo  djecu odgajati kako misle da treba tvrdeći da to rade po - kršćanskom nauku.,Molitelji dovukli djecu iz zbora da im poziraju s plakatima,link,http://www.index.hr/vijesti/clanak/molitelji-dovukli-djecu-iz-zbora-da-im-poziraju-s-plakatima/959110.aspx,2017-03-25 06:26:12,224,128,11,37,0,1,12,30,144
107861655950370_1406925349377321,Stigla beba! :),Gordon Schildenfeld i lijepa Grkinja dobili prvo dijete,link,http://www.index.hr/black/clanak/gordon-schildenfeld-i-lijepa-grkinja-dobili-prvo-dijete/959111.aspx,2017-03-25 06:26:08,124,1,0,122,2,0,0,0,0
107861655950370_1406925222710667,Index Vijesti: Potraga okončana tragično,KRAJ POTRAGE Nestali Riječanin pronađen mrtav uz cestu kraj Plomina,link,http://www.index.hr/vijesti/clanak/kraj-potrage-nestali-rijecanin-pronaden-mrtav-uz-cestu-kraj-plomina/959103.aspx,2017-03-25 06:26:03,211,8,2,73,0,0,0,136,2
107861655950370_1406899956046527,Ona je već imala pobjednicu u svojoj glavi :D,VIDEO Misica saznala da nije pobijedila - njezinoj bijesnoj reakciji smije se cijeli svijet,link,http://www.index.hr/black/clanak/video-misica-saznala-da-nije-pobijedila--njezinoj-bijesnoj-reakciji-smije-se-cijeli-svijet/959105.aspx,2017-03-25 05:49:06,161,19,2,147,0,0,14,0,0
107861655950370_1406851512718038,,"Meksiko na vrhu, Chicharito srušio rekord",link,http://www.index.hr/sport/clanak/chicharito-rekordom-odveo-meksiko-na-vrh-pulisic-zabio/959098.aspx,2017-03-25 05:12:22,34,1,0,34,0,0,0,0,0
107861655950370_1406851456051377,,"Bogdanović potopio svoju bivšu momčad, Hezonja i Zubac slavili",link,http://www.index.hr/sport/clanak/bogdanovic-potopio-svoju-bivsu-momcad-hezonja-i-zubac-slavili-/959090.aspx,2017-03-25 05:12:18,34,1,0,34,0,0,0,0,0
107861655950370_1406851372718052,"Srpski mediji pišu o ""Generalu"".","Srbi o ""Generalu"": ""Naši glumci u tom filmu ne žele glumiti ni za tisuće eura""",link,http://www.index.hr/black/clanak/srbi-o-generalu-nasi-glumci-u-tom-filmu-ne-zele-glumiti-ni-za-tisuce-eura/959101.aspx,2017-03-25 05:12:15,172,124,1,110,6,1,55,0,0
107861655950370_1406851279384728,"Index Mame: ""Mislim da ovo vizualno jako dobro pokazuje u kakvim bi se situacijama moglo naći dijete u slučaju nezgode. I to puno jače nego ovako""",Lekcija o autosjedalici koji bi svi roditelji trebali pogledati,link,http://www.index.hr/mame/clanak/lekcija-o-autosjedalici-koji-bi-svi-roditelji-trebali-pogledati/959099.aspx,2017-03-25 05:12:09,16,1,1,16,0,0,0,0,0
107861655950370_1406851182718071,Index Fit: Kaže kako se u 40. godini života u vlastitom tijelu osjeća izvanredno.,Candace Cameron Bure u 40. godini izgleda bolje nego u 20-ima. Kako?,link,http://www.index.hr/fit/clanak/candace-cameron-bure-u-40-godini-izgleda-bolje-nego-u-20ima-kako/900714.aspx,2017-03-25 05:12:05,10,0,0,10,0,0,0,0,0
107861655950370_1406851129384743,Malo nam je žao Georgea :/,Princ George neće imati najboljeg prijatelja zbog pomalo čudnog razloga,link,http://www.index.hr/black/clanak/princ-george-nece-imati-najboljeg-prijatelja-zbog-pomalo-cudnog-razloga/959097.aspx,2017-03-25 05:12:02,110,5,2,107,0,1,0,2,0
107861655950370_1406829589386897,,Hamiltonu ispred Vettela do prvog pole-positiona nove sezone,link,http://www.index.hr/sport/clanak/hamilton-ispred-vettela-do-prvog-polepositiona-nove-sezone-/959094.aspx,2017-03-25 04:35:06,10,0,0,10,0,0,0,0,0
107861655950370_1406829532720236,Svi će imati mišljenje o novom projektu slavnog repera.,Jay Z snima kontroverzni dokumentarac o kojem će se sigurno voditi žestoke rasprave,link,http://www.index.hr/black/clanak/jay-z-snima-kontroverzni-dokumentarac-o-kojem-ce-se-sigurno-voditi-zestoke-rasprave/959096.aspx,2017-03-25 04:35:02,8,1,0,8,0,0,0,0,0
107861655950370_1406829476053575,Poznato vam je ovo? :D,Ovo je razlika između muškaraca i žena,link,http://www.index.hr/black/clanak/ovo-je-razlika-izmedu-muskaraca-i-zena/959092.aspx,2017-03-25 04:34:58,22,0,3,21,0,0,1,0,0
107861655950370_1406829379386918,Index Vijesti: Prometna kod Našica s tragičnim posljedicama.,"FOTO Crni početak vikenda na hrvatskim cestama, četvero poginulih u tri nesreće",link,http://www.index.hr/vijesti/clanak/foto-uzasna-nesreca-kod-nasica-dva-muskarca-sletjela-u-kanal-i-poginula/959095.aspx,2017-03-25 04:34:52,38,3,1,18,1,0,0,19,0
