"Kad ste prije 5 sati objavili članak o ljudima koji su smršavjeli imala sam poriv prokomentirati kako je to pohvalno, ali da biste kako bi ostali dosljedni sebi hitno trebali objaviti nešto čime glorificirate pretilost i... Evo ga. -_-",2
"Otac joj se bavio politikom pa i ona vidjela da se od toga najbolje živi ,pogotovo kad kopa po prošlosti jer za budućnost nema ideja",1
Ovo je bas zlocesto. Svatko neka ima djecu kad se on/ona osjeca spremno. Cemu potreba da se sebe uzdize i opravdava naspram drugih promicuci bas svoju odluku i stil zivota kao najbolji?,1
"Šveđani dragi moji Slušajte me sada svi Hrvatsku sad treba spasiti Vaše pare, nama prebaciti   Što ćete u toj zemlji hladnoj Tu je raj na zemlji bajnoj Kontejneri vas prazni čekaju I puste ulice dozivaju  Ovrhe i blokade nove Žrtve iz Švedske sada love Vracajte se , što čekate Pare ajmo sada dajte  Da nam Plenki i Hanži budu zdravi To je za dijasporu put pravi, Sve ce vam vaša balerina reći Kako što prije vlada da vas usreći  Spremamo vam porez novi Stanove i kuće ko orao lovi Što ce vama nekretnine silne Karton, ulica i kontejner vam ne gine",1
"Veseli Čvarak sigurno joj nije posao da nas javno sramoti,ali to odrađuje 100%",1
"Nemozete no ovim Šta su u Hrvatskoj pomoć,a kamoli je neko lud da se iz Švedske vraća u Hrvatsku,kojoj je Prijesednica osoba. Koja zna za kaznena djela,ali nije njezin posao da se miješa cccc....",1
"Ne lupetaj monade,dosta nam je tvojih gluposti.Prvo vrati svoju djecu,Ujedno dosta je tvog sramotnog pricanja  gluposti.Jedini izlaz je napusti svoju duznost jer nisi sposobna!",1
Ma neću više ni jedno slovo potrošiti na ovu iskompleksiranu debelu curu.Tjedno minimalno 3 puta se o njoj piše.Što je previše je previše.,2
"25 godina glasam za pojedine stranke jer sam čuo biti će sutra bolje,ako nemogu zaustavit iseljavanje neću ga više ni poticat zato neću više glasat za nikog,osim za onogog ko do 2020 digne minimalnu neto plaću na 5000 neto za 180 sati rada + prekovremeni,rad vikendom,blagdanom,rad u smjeni,nadam se da u građanskom neposluhu neću biti sam,dok se ne podigne minimalna neto plaća za 180 sati rada na 5000.kn neto vršit ću građanski neposluh i na svim izbornim lističima ću samo napisati...tražim minimalnu neto plaću od 5000,kn za 180 sati rada...lp",1
"Razumio je on dobro, ali mu se ne svidja ;-), a znam i zasto :-) ;-)",2
"Ne mogu vjerovati da postoje ljudi kojima je stalo do ovakve repke, i još plaćaju da bi to gledali na ""stadionu"",strašno!",2
To natjecanje je ionak najobicnija idiotarija. Ali pokazuje u kojem smijeru ide smrdljiva Eu,3
Vazno da je ona nakotila desetero i ni jedno abortirala Uzor za nase moliteljice.zena.majka.kraljica.Kamo lipe srice.da su je.sterilizirali cim se rodila.,1
Kazu Hrvatska je pri vrhu nesreca po broju stanovnika pa  su odlucili tome stati  na kraj poskupljenju cestarina i poskupljenjem automobila tako da se sa sto starijim autom vozis po starijoj i nesigurnijom cestom i time pridoneses da budemo uvjerivo  najgora drzava sa najstarijim voznim parkom,1
Dakle napredniji su od nas. I ako ukidanje jednog sata fizicke aktivnosti ne smatram najboljem rijesenjem. Kod nas ce prije uvesti vjeronauk kao obavezan predmet.,1
treba mozda koju fontanu napravit ispred skole ? :D,1
"Puno faktora ovdje igra ulogu. Kao prvo u ovim podnebljima za razliku od sjevera i zapada tradicionalno se ostaje dulje u obiteljskom domu, drugi faktor su definitivno nezaposlenost, ugovori na odredeno i niske place, zatim razmazenost mladih generacija koje radije zaradeni novac trose kao deparac na izlaske i zabavu umjesto da pomalo placaju svoje zivotne troskove. Zatim vecina mladih koji i mogu mozda otici je razmisljanja da ce radije biti doma pa udjeliti nesto roditeljima, nego se useliti s cimerima i time sniziti zivotni standard na iducih par godina. Nakraju nasa blesava tradicija je da se kuce i stanovi kupuju a ne iznajmljuju. Gradnja kuca na 3 kata dobra su opravdanja da se ostane doma. Kad shvatimo da nema nista lose u tome da si u podstavarstvu s 1-2 cimera i kad se mladi odlijepe od roditeljske suknje i shvate da se u zivotu treba malo i borit a ne kompletnu placu trosit kao deparac mozda se nesto promijeni. Cast iznimkama a roditelji probudite se i djetetu nogu u rit neka se snade sam!",3
"kao i obično....... za svoje se šuti i stoji se ravno, a za 100 000 mladih što su također otišli no na sreću možda ne i trajno.... za nih se pleše, pjeva, smije se..... zapamtite jedno... NARODNI ĆE SUD BITI STRAŠAN",3
"Zanimljivo je i to da je na našem Plesu sve 5 puta skuplje nego na npr. Pearson International Airport-Toronto, Canada. Istina, na tu zračnu luku slijeću avioni svake 2 min., sto bismo mi uopće mogli naučiti od njih, zar ne.",1
"Bravo za novoosnovani fan klub u srbiji! Fakat ih treba sprdati kad su glupi ko noc, sami su si krivi.",3
"Tomislav Kalivoda a to što imaš 3x veću plaću, i 10x bolji mentalitet  u Švedskoj, to nema veze. Bitno da ti trebaš žalit Hrvatsku koja odumire zbog lopova poput nje :D",1
Da....kad ti netko pruzi cvijet..a pogotovo dijete...to je nesto najodvratnije...vrh provokacije...ccc...na kojoj planeti zivimo jbt,2
Toooo daj fontana sta ce ljudima tvornice !,1
NI HDZ-e NI SDP-e TO SU BANDE LOPOVSKE!!!,2
"Mišo crkni stari smrade, tolike godine, a pemeti ni trunku nemaš.",3
"Cerce kakva smrt, ovdje je pravi milje za tebe. Za dvije godine vec te vidim kao gradonacelnicu.",3
"Odgajali su princa,a odgojili bahatog ubojicu,koji misli da mu je sve,baš sve dopušteno.Ista je prića s mladim Koradeom,Culejom i sličnom djecom lokalnih šerifa.",2
"Puno njih djecu uopce ne odgaja! Nisu oni njega krivo odgajali, nego ga nisu uopce odgajali! Ucinak je isti!",2
Anđela Orbanić prilicno pristojno izgleda na ovoj slici :D,2
"dovoljno je momku provirit na fb profil da se zaključi da je teži psihijatrijski slučaj. čuj to, fin momak.",2
Muškarcima koji imaju tvrdu stolicu barem dva slobodna dana\xe2\x98\xba\xe2\x98\xba\xe2\x98\xba,2
"Neka. Hrvatima i gaće treba skinuti i puknut nogom u guzicu. Ni onda neće shvatiti što im se dogodilo. Loša genetika, jbga.",1
Ne seri,2
"Todoric je ovo zno prije dvije godine i postavio sina u vladu,sad drzava kupuje socijalni mir nasom lovom,a todoric nema nikakve odgovornosti jer je firma doo. On je samo uzo lovu,i bas ga briga za stecaj,drzava ce namirit porezom na nase nekretnine.end of story.",1
Bozica popijte tabletice i na spavanje..,2
"Kod nas ništa ne vrijedi, ni rad, ni poštenje, samo krađa i korupcija od ""poštenih"" političara. Bravo Lupino!",1
Fran Storelli  marširakli su prije nekog vremena.pa skup na tomsonovom koncertu...,3
Znaci cetnici ili ustase za mene isto zlo,2
"bezveze, ako je otišla nema vraćanja!",3
Evo odmah mi je život bolji i ispunjeniji zbog te informacije. Hvala Index. Pravi ste humanitarci.,3
"Pa otislo je organa i u strane drzave, zar on ne zasluzeje bubreg ? Meni je svejedno jel nogometas ili stolar, prije svega je tesko bolestan.",1
ja sam isto na dijalizi i na listi neznam zasto tolko dramatiziraju oko njega,2
"Bila mu ljepsa Camila.Ime joj bas odgovara ""curama"" iz pustinje.",2
"A gdje je tu bijesna reakcija ! ! ! ? ? ?""",2
Možda Vlada donese zakon o promjeni naziva Hrvatske u  K plus KRVATSKA!,1
"Koja vlada,Todorići je vlada,a oni su njegova potrckala,zna on dobro da mu nemogu nista,jer bi nastao opći kaos,jer su u pitanju na desetine tisuća radnih mjesta. Njega je se vec odavno trebalo staviti pod kontrolu.",1
Draga moja meni ne treba moda ... lijepa oblekica .. ja imam 40 godina i nemam celilita ni strija ja sam prirodna .. draga moja 2 kile šminke i treba  maskara i pola kreča da izgledaš fina i lijepa ... to baš nije lijepo tak može i baka od 90 izgledati :) .,2
"I jos uvijek .. HDZ + SDP .. znaci nema pameti , nema napretka .. samo cvilite dalje , ali dokle iste birate .. ma sta govorim samo cvilite i dalje , neka vam djeca gladuju .. mozda onda netko i digne glas ..",2
"U panici sam i ja moram platiti porez na nekretniine, a od čega? Pitam se da li će platiti i Agrokor porez na nekretnine, već mu je oprošten dug od 400 000 000.00 kuna. Država oprašta samo od čega - poreznih obveznika. Mili Bože koliko nula.",1
Ti si bolesna,2
"Koje institucije??? Toliko uhljeba, a nitko ne provjerava ovakve stvari. Tom gadu zelim istu sudbinu da polako jako polako crkava.",1
"Ne mogu vjerovati u kakvoj državi živim, kako nitko ne reagira, gdje su nadležne inspekcije, jel netko prijavio zlostavljanje životinja?Jednostavno netko bi trebao tamo otići i pustiti životinje da izađu van da se ne muče. Dajte novinari učinite nešto!!!!!!!!!!!!!!!!!!!!!",1
"Hahaha,sramoti itekako..",2
kako nezna? pa zar nije neki dan glumila u Labuđem Jezeru?,1
"Joj ne budalite, razmislite malo svojom glavom! Djeca im ne rade svaki dan, nisu robovi.. Imaju točno definirane zakonske granice s koliko godina mogu početi raditi i koliko sati smiju raditi tjedno i mjesečno, s obzirom na dob. Raspitati se prvo malo, ne odmah pisati debilne komentare!",3
"LAŽU! Ja imam 52 godine i tvrdim da Konzum u Hrvatskoj nije postojao prije završetka Domovinskog rata. Prije Konzuma bio je Velpro, a prije njega Alastor. U Jugoslaviji nije postojao ni Unikonzum niti što slično. Bili su Supermarketi i NA-MA i male trgovinice raznih naziva...",1
a onda ih hvata po Svedskoj ko kuja mlade i vice vrqtite se majka vas zove ahahaha,1
Kasno Marko na Kosovo stiže ali IVA nikako da pameti dođe..,2
"Ne, ionako će svi govorit: Pleso ;) Taman posla da je zovem Franjo Tuđman :D",1
Ziher...kod mene ne pali...Pa ne mogu isto ljubazan ton...kad ih hvalim ili upozoravam da slusaju....pa moraju cut razliku....tona...i tako znat da to sto rade nije uredu....Zbog takvog stava zato i jesu neka djeca takva nedodirljiva...Tko me svatio razumjet ce.....,1
"Mi ""huligani"" kako nas nazivaju placeni mediji smo isti oni koji su prvi došli u poplavljenu Gunju, Mi ""huligani"" smo ti koji smo došli u posjetu Željku Mariću nakon šta je pušten iz srpskog zatvora. Mi ""huligani"" smo ti koji organiziramo kolonu sjećanja za Vukovar u gradu Splitu. Mi ""huligani"" smo isli među prvima uzeli pušku i išli u rat. Mi huligani nismo zastićena stoka poput gube od politicara.  ""Margaret i huliganizam u Engleskoj.""  Budimo iskreni i realni i priznat da je Margaret riješila to lakse i jednostavnije jer je Engleska država u kojoj zakon vrijedi isto za ""huligana"" i korumpiranog političara. Vrlo jednostavno. NEMA U ENGLESKOJ VIDOSEVIĆA ,MAMIĆA ,SANADERA , BANDIĆA.. NA UTAKMICI ENGLESKE REPREZENTACIJE U LOŽI NE SJEDI HORVATINČIĆ CETVEROSTRUKI UBOJICA KOJI NIJE BIO DANA U ZATVORU JER JE DONIRAO NOVAC PREDSJEDNICI.  Lijep pozdrav iz Splita.",1
"E vidite, ovo je jedan od razloga zasto Hrvatska nikada nece biti poput Svicarske. Ne treba suvise objasnjavati.",3
"tkogot je ovo sastavljao nema ukusa! Tom Hiddleston, Jason Statham, Robert Downey Jr, Chris Olsen su ružni?!? mislim stvarno? Tom je jedan predivan britanski gospodin. Jason je mačo kakvog svaka žena želi. Robert je među zgonijim glumcima današnjice. a Olsen je jednostavno sladak i zgodan. o ostalima da i ne pricamo -.-",2
"Po broju lajkova i komentara, nažalost se vidi samo to da roditelje u ovoj propaloj zemlji ne zanimaju njihova djeca i ovakve teme...",1
Ilija rvatino te ajde počasti one naš penzijonere što nakon 35.god radnog staža nemaju ni da pristojno umro! Pišam ti se usta seljačino!!!,3
Pero - želim ti otkaz - kredit koji ne možeš otplaćivati - burzu rada - pa da vidimo za koliko ćeš naći posao i za koju placu - usput blokadu od fine,1
"ma ne kužiš ti to, to ti je viša razina humora koju mi obični smrtnici nismo u stanju prokljuviti. ne mogu to objasnit, ali sam uvjeren da je nešto urnebesno.",2
Sada može i otići i vjerojatno hoće jer je odradio posao zašto je došao Agrokor spasen a mi ga opet popušili,1
"Maja Sanja Plenkovic svi smo izgubili nekog...pa nismo postali idioti koji vjeruju u fikciju i nadaju se nemogućem! Živim za danas i sutra a ne za uzaludnu nadu da će nešto biti poslje smrti! I da,biti ćeš sa svojim djetetom ako budete pokopani u istom grobu...ali nećeš biti svjesna toga jer ćeš biti mrtva! Čim prije se okaniš gluposti i prihvatiš realnost tim bolje za tebe!",1
"Ne mogu vjerovati koliko zlobnih i mrznjom punih komentara... ""Glupo dijete,.. ""Tako mu i treba isl"".. Pa dobro ljudi koji je vama k.... Je li sad bitno zbog čega je došlo do tragedije??? Riječ je o djetetu.... Stavite se samo na trenutak u kožu tih roditelja.... Koji nikad vise nece vidjeti svoje dijete,čuti njegov glas,njegov smijeh.... Ma kako vas nije sram???? Onaj kreten Dejan Barić,na ovu tragediju ima obraza napisati... ""Glupo dijete,jedno manje""??? Pa kakva li je majka odgojila takvog monstruma???? Nije bitno zasto... Bitno je da je ugasen jedan mali zivot...jedno dijete koje je tek počelo zivjeti i koje nije još bilo sposobno donositi odluke i biti svjesno posljedica... Ne dao Bog nikome... Maleni počivaj u miru..obitelji iskrena sućut... A iako nisam zloban svim ""Dejanima Barićima"" i njima sličnima,od srca zelim da iskuse ovakvu tragediju pa da vidim da li će i onda imati iste komentare....",2
a kad ce place poskupit!!??? ccc,2
"Nemaju pojma ni šta bude za sat vremena, a oni pričaju za tjedan ili dva, da nije tužno bilo bi smiješno.",2
"Jednu godinu prijeti ISIL drugu Rusi treću Turci, ajde jebite se više svi....",2
"Odlično, da je nakon potopa na izborima ne vidimo i ne čujemo više",1
"INDEX???? Kako možete za gđu napisati ZVIJEZDA??? Haloooo. I vjerojatno ste mislili petokraka!!! To je novi desničarski križ, a ne zvijezda.",3
Šta pričaš ti? Josip Broz Tito je bio največi zloćinac u hrvatskoj povjesti... Franjo Tuđman je otac hrvatske domovine... Franjo zaslužuje da mu se napravi glavni grad po njegovom imenu...,3
Egocentrični polukriminalci grade fontane našim novcem a u rad ih puštaju paraziti koji tim fontanama nisu pridonjeli ama baš ništa..,1
"Bas gledam malo profil od tog malog,nije bas tu sve kak treba.",2
Dolaze debilne generacije!!!!,3
Vrlo vjerojatno je tata pomogao da ne zavrsi u zatvoru i time sam sebi presudio! Da ga je strpao u zatvor na vrijeme pomogao bi i njemu i sebi!,3
A šta je sa ravnopravnosti spolova. Svima tri dana ili nikom.,3
"Mozda se netko sjeca da je u doba Jugoslavije svaka zena imala 1 dan u mjesecu slobodan i opravdan upravo zbog menstrualnih problema. Ali to je bilo u onom mraku, crnilu i diktaturi.",1
Vau ovo jednostavno nije outfit za djevojku od 19 godina. Neznam samo tko ju je savjetovao da se ovako obuče i našminka? Totalni promašaj!,2
Potrebna im je pauza ha haaa. Kad se osoba pravo zaljubi nejde na pauzu od ljubavi. Pravi ne odlazi.,2
"Bilo je za očekivati , lik živi u dvorcu , mi mu plaćamo dugove , naravno i dalje mrmljamo ali ništa ne poduzimamo ...Šutimo već 25 godina i gledamo kako dvjesto ljudi krade naočigled , kupuju firme miliunskih vrijednosti za 1 kunu , otupjeli smo i postali inertni , eto počeli smo i odlaziti iz svojih domova , ljudi su poniženi i poraženi , jednostavno su odustali , digli ruke i od ove države i od samih sebe ...Na vlasti su školovane lopine , počeli su raditi kaznena djela već na tobožnjem fakultetu gdje su kupili fakultetsko obrazovanje , tu su odmah hrabro plagirali radove onih koji su se ubijali učeći dan i noć , sad su ti učenici poniženi i uglavnom nezaposleni , bez  vjere u sustav , a lopine su na vlasti i na državnim jaslama ...Sve bi ih trebalo poslati na goli otok , i dati priliku novim ljudima ...Samo jednu stvar ne razumijem kako stalno biramo iste stranke , oni su  bilo to HDZ , SDP ili koja god hoćete stranka koja je nastala u vrijeme rata doveli državu i ljude do ruba , isisat će i ovo malo što je ostalo , pobjeći negdje gdje već imaju tajne račune , a sirotinja će ostati...",2
"Baci pogled na George Clooneya da vidiš kako treba pravi muskarac izgledati, pa si daj malo truda ;)",2
"Prije 20 god se o tome nije ni raspravljalo. To je tak i gotovo. No sad je ocito drugo prica i sve nam smeta.Sat vamo, sat tamo..dodje na isto :-)",2
"pa ta predsjednica države je izbjegla platiti porez državi kojoj je predsjednica,potiče fašizam,unosi nemir i razdor svom narodu,podržava,brani i potiče kriminalce i lopove.otvoreno stoji i potiče hdz-e,stranku koja je opljačkala i unazadila hrvatsku itd.moglo bi se nabrajati tri dana,sve negativno,dok pozitivnog nema što.dajte više progledajte,i počnite nazivati stvari pravim imenom.vidite gdje nas je dovela ona i njeni lopovi koje štiti.",1
"Ovdje nije riječ o stranci, već o osobi.",1
"A sto netko mora znati javno da se odrice pola palace....Evoja  imam placu 12.000kuna jedan dio nije vazno koliko ide u jedan grad  u Hrvatskoj za jednu obitelj godinama i nitko ne znna ,cak ni moji roditelji.Tata i da zna ne bi nista rekao, a mama bi svasta nnesto rekla bila bi provit toga.Sto je za Vas normlano ponasanje ?Sto je za Vas normano ,mozda za mene nije i suprotno.Ko ste Vi da postavljate norme i pravila normalnosti?Malo sebi dajte previse slobode u komentaru a nemate osnova za to ....",2
A vi klošari iz index-a ste jedva dočekali neku sliku ovakvu na temelju koje bi zaradili na tiraži ili sta god vec....,3
"""Uču"" djecu?!?! Tebe novinarčiću očito nitko nije učio!",3
di su sada šatoraši da zaštite prava maloga ćovika il je klem dobijo što je tijo  pa ga više nije briga,1
"Borili smo se u Ratu za slobodu Hrvatskog naroda ,mislim da BORBOM PROTIV VLADE nije ništa drugačije, ajmo više srušiti tu Vladu koja na svakom minutom šalje korak unazad,radi siromašnima i očajnima.. I okreće jedne protiv drugih dok se oni smiju ,jer vide da ništa na radimo ,ja sam ziher da bi mogli nešto napraviti kad bi htjeli a ne samo srati u bradu..",3
Ma veliki bravo na komentaru gospodo Volarevic. Rekla bih majka i kraljica. Imate vece bogatstvo od ijedne ovakve,2
"U nekim se godinama definitivno treba odreći ili face ili guzice. Koje kilo joj ne bi falilo. Krasno je obučena, ali totalno neprimjereno njenim godinama. Po Splitu ima daleko zgodnijih žena njenih godina, prirodnijih i ljepših, koje su puno manje od nje uložile u svoj izgled.",2
"Pivaric igra kao Alba, ali Jessica Alba",2
Daj broj dilera u inbox,2
Jba vas Agrokor.Ovi su lopovi ko i on.Sve bi ih trebalo prid zid i pucati po njima,3
"Zakon da zaštiti Agrokor,a ne sjeti se napraviti zakon kako zaštititi 3 i pol milijuna Hrvata (onih 200 000 sam namjerno izostavio,jer su to mahom ulje i, državni službenici i političari te ratni ili profiteri raznoraznih  profila..)!!! Jebem vam onog ko ko vas dovede na vlast...ili HDZ i SAP, ma sve i je s an političar je izdajica...!!!Baš sam ljut!!!!!!",1
"Uz sve firme koje je Todorić upropastio,izgleda da mu jedino dobro ide s uzgojem i dresurom čistokrvnih pizduna.(skoro sam napisao pasa,ali sam se sjetio da psi imaju samopoštavanje i karakter)",1
"Ništa me nebi iznenadilo, jer da nije njegov već bi on tužio za svoj "" LOGO""",1
"Zna se vec kako su i orijentisani ti navijaci Ukrajinski, nisu trebali prekriti cvijecem tablu FAN CLUB  AZOV  Ovo je vise politicki, daju podrsku HDZ-ovoj politici. Nema ovdje iskrenih najmera odavanja pocasti.""",1
"Na žalost i oni su osjetili sve ""blagodati"" komunizma.I to na mnogo gori nacin nego mi.Njih je samo od izglednjivanja umrlo 5 000 000,a znamo tko im je uzeo hranu.""Brača"" rusi,koji im i sada žele komadati državu.Imamo puno sličnosti sa njima,pa od tuda i naklonost među navijačima.",3
"Prozor padne na učenika da mora doći Hitna pomoć i onda ovaj kaže da netko dramatizira. To nije za nekakvu diskusiju ili par šamara, to je za mlatiti dok nisi siguran da si mu ostavio trajne psihičke i fizičke posljedice",3
"ma izvlači se on iz pičke materine. znamo da je budaletina, ali tolika, nitko nije znao",3
"Iva Babic a nasto smo to mi zene ljubomorne mozda na njezine gluposti , neizvrsena obecanja ili sto je na tetet poreznih obveznika putovala u Ameriku i plastificirala se ili pak na to da misli da smo mi glupi pa nevidimo  sto radi i da nas drzi za budale i da nam se ruga u zdrav mozak blazeni oni koji to nevide i nesvacaju jer njihovo je kraljevstvo nebesko",2
ostavite vise zenu na miru....odvratno,2
"to je odradila liposukciju na onom novogodišnjem putu u ameriku, onom koji je proglašen držanom tajnom.",2
Nije mahao vec Ga izvadio da ga oladi kao i žene sta sise izbace pa eto da se vidi da imaju,3
"Lažno oglašavanje. To je u većini zapadnoeuropskih država kažnjivo jer potrošačima daje lažnu sliku o onome za što daju svoj novac. Prvo da Konzum posluje 60 godina a drugo da tvrde da će i sutra biti na tržištu, što nije izgledno, a ako oni znaju nešto što mi ne znamo, a plaćamo, onda je to opet posao za DORH. Naravno, pod pretpostavkom da imamo državu",1
"""osvjetliti Hrvatski obraz"" ...",3
Ne volis..odvojeno.,2
"Jer uzrokovanje nereda koji će rezultirati prekidom utakmice je vrlo produktivan način za rješavanje problema u nogometnome savezu. To može rezultirati samo time što će u svijet otići slika ""civiliziranih"" Hrvata kako opet izvode cirkuse na nogometnim utakmicama.",2
"Glavni problem su vam navijaci a to kaj nas ovi kradu vec 20 godina,nikom nista a?Kakve ste vi ovce majko mila..Pa ti decki su jedini koji imaju JAVNO muda rec kakvo je stanje u drzavi..Oni ne sjede doma i ne kukaju za tipkovnicom,ti decki vode svoju bitku kak god znaju..Nisu oni uzrok vec posljedica..Dok je mafije u nogometu,bit ce i nereda! ""Narod bez kruha i na rubu plača a oči se mažu problemom navijača!""",2
"Neće se sad vjernici i molitelji javiti, jer čak ni oni nisu toliko glupi da ne bi shvatili poraznost ovakve ministrove izjave i posramili se ovog vrhunskog komentara.",1
"Dragi liječnici i ostalo medicinsko osoblje. Vaš ministar se upravo posrao po vama... ono, ako niste sami primjetili. Meni je žao što vam je Kujundžić ministar, volio bi da vaše interese zastupa netko pametniji. Sretno i hvala vam što nas liječite... meni je jedan doktor važniji od 100 popova \xe2\x9d\xa4",1
"Ko ministar bi se trebao pobrinut da takav tretman pacijenti dobiju od doktora i sestara koji u bolnicama rade, primjerice u splitskoj bolnici u kojoj imaš sreće ako te netko i primjeti, a da prethodno nisi podmaza koga već treba! Lupetalo, a ne ministar !",1
Rade na demografiji a ovim su činom potjerali iz zemlje barem još 10 mladih ljudi,1
"Kakva država takvo pravosuđe,za kurac",1
Najsmijesniji su mi ovi sto ih nije  briga...pa zasto komentirate ak vas nije briga...veci problem je to sto je ovo 15.ti put da je proglasavaju trudnom..ne smije se zena ni najesti niti biti naduta da joj neka budala ne prikaci eventulanu trudnocu...,2
"Hristina Azirova ,nije debela????",2
"Klasika na indexu, Srbe dižu u nebesa, Hrvate iz Hrvatske ne ističu ako ne moraju, Hrvate iz BiH pljuju i omalovažavaju kad god stignu.",3
Kad stavljamo kiseli krastavac da obiljezimo dan qrca?,1
Ilija Gromovnik triba da si pod hitno najde curu ili dečka.Sperma mu več navire u mozak.,2
"Nije nijedno zdravo, ali reci za ovu da nema visak ili da to ne treba jasno reci jer, eto, body acceptance gluposti, je smijesno.",2
Silvio ide od statusa do statusa i trola sve koji kazu da je ona debela... on je vitez na zadatku.. nesto kao Don Quijote... vidi znajeve gdje ih nema.. :) i da... krmaca je debela.,2
"Glavno da si ti zgodan, čunjoglavi Silvio/Anđelko.",2
Igore pokopati svoje dijete je nesto najgore sta se moze desit nekom roditelju.Ako zena ima vjeru i to je jedino drzi da ide dalje nije zato idiot .Da slazem se da smo svi izgubili neku dragu osobu ali nista se nemoze mjeriti sa gubitkom svog djeteta...,3
Sramite se gospodine Igore B kako ovako odgovarati ljudima koji su pretrpjeli tragediju a jos uvijek vjeruju!!!To samo mogu tako pisati mizantropski nevjernici puni gorcine i bijesa! A vi ostali koji stajete na njegovu stranu procitajte post pa komentirajte jer nije rekao samo neodgojen vec IDIOT!Sramite se nevjernici kako komentirate tudu bol,3
Uhh..jako zanimljiva tema..boli me ona stvar šta su kupile i koliko platile...ne bi se naravno sjetile da obiđu bolesnu djecu po bolnicama i da im daruju neku sitnicu koja bim im uljpšala dan..!!!,2
steta da novcima nemozes kupiti mozag,2
"Pa Pero je troll koji se zabavlja kad mu odgovarate na komentar! Kad ga počnete ignorirati, dosaditi će mu pisati gluposti po portalima",2
Ivan pernar,1
Maric je u sukobu interesa! Spasava obitelj todoric porezima na nekretnine.u kapitalizmu nema ovega....govno,1
"Normalno- kod nas to prvo ide na ministarstvo, pa izmjena zakona, pa tri čitanja u saboru i rasprava ( o četnicima ustašama i partizanima - pobačaju, tko vodi HRT) e, a onda ako zakon prođe ustanovi se 20-ak provedbenih tijela i sve skupa čeka odobrenje EU! Naravno nekoliko odbora to usklađuje sa spomenutom EU!",3
Wow velika stvar... pa nek se seksaju sta tu ima bit zanimljivo ko svi su sveci niko to ne radi... hehehe bolje to gledat nego nesrece i nasilje,1
"Bolje nju gledati u takvom izdanju nego neku pretilu, celulitastu guzicu i mlitave noge mnogih danasnjih dvadesetogodisnjakinja...",2
Jaka i lijepa.Slabim muškarcima zastrašujuća.,2
"Sve super,ali zasto Dr Franjo Tudjman???",1
Pa ja nemogu vjerovat ona se bori za borbene avione a toliko gladnih i blokiranih u hrvatsku pa kamo ovo više vodi,1
Pa nemoj ići na abortus!,1
"Vratite se,trebamo vas jer više nemamo šta guliti...",1
Andja Mestrovic ti si prirodno glupa ili su u pitanju neki narkotici?,2
"Samo treba ovčice za strizanje i nikaj drugo, vratite se i plačajte namete kao sva ostala stoka u Hrvatistanu jer mi sami ne možemo preživjeti bez krađe vašeg novca samo zato jer smo apsolutni idioti sa predznakom stranke koja vas krade zadnjih 25 godina.....Dobro Došli nazad(where is my money????)",1
