"Zašto neki navijači ne mogu navijati za tu ""repku""? Obični čovječe, pokušaj razumjeti zašto neki navijači ne mogu navijati za tu \xe2\x80\x9erepku"", a u srcu krvare jer vole Hrvatsku.  Znate, bio sam u Francuskoj 1998. godine, na utakmicama kontra Argentine i Njemačke. Sjajno je bilo. Hrvatske kockice na tribinama. Prepoznatljivi smo bili. Ponosni. Pune tribine, pravih navijača. Nije bilo onih selfie, Konzum navijača. Grmilo je tada s tribina Hrvatska, Hrvatska. Nijemci se nisu čuli u Lyonu, tihi i pokisli. Igrom slučaja završio sam tu utakmicu na Njemačkoj tribini. Kupio karte u nekih marokanskih švercera i možete zamislit moje iznenađenje kad sam sa suprotne strane vidio naše trobojnice.  Nas petoro umotano u Hrvatsku zastavu među 10.000 njemačkih navijača. Ponos kao nikad. Pobjeda 3-0 i \xe2\x80\x9eaufidersen"" je grmilo stadionom. Pozdrav Njemačkoj. Strijelci: Jarni 45\xc2\xb4, Vlaović 80\xc2\xb4 i Šuker 86\xc2\xb4. Da, isti ovaj Davor Šuker je nekad suze radosnice navijačima na lice donosio. Kupali smo se tada po fontanama od radosti, spavali po parkovima, pozdravljali su nas i prepoznavali svi. Završilo je brončanom medaljom i uz onu košarkašku iz Barcelone to je ostalo najveće timsko dostignuće ponosne nam lijepe naše.  ""Gadni kad se ujedinimo""  Bio sam nakon toga u Portugalu 2004. na Europskom prvenstvo. Opet mnoštvo naših navijača. Prevalio se dug put, gomilom kombija, aviona \xe2\x80\xa6 Posjetili smo Fatimu. Čak smo i Engleze navijački nadglasali, bez obzira na poraz. Ispali smo u prvom krugu.  Uslijedila je Njemačka 2006. i utakmica u Berlinu. Nas na tribinama 30.000, gubimo od Brazila, a ponosno pjevamo. Ma šta pjevamo, grmimo. Brazilski komentatori su se ježili. Nisu mogli vjerovati svojim ušima i očima, a još kakva su oni emotivna navijačka nacija.  Da, gadni smo mi Hrvati kad se ujedinimo. Goloruki rat dobijemo.  Te 2006. godine sam zadnji put bio na završnici \xe2\x80\xa6 U Hrvatskoj je već tada, 2006. godine nogomet bio ukraden narodu. Slično kao u privatizaciji tvrtki. Ovaj put preko ""neprofitnih"" udruga, malobrojni su profitirali. Financijski ili utjecajno. Pokojni Marković u savezu, Mamić u Dinamu, Grgić u Hajduku, Širić u sudačkoj, raznorazni menadžeri u transakcijama igrača, selfie navijači s poklonjenim ulaznicama na trbinama, političari i zastupnici u županijskim skupštinama kojom trenirkom i dresom. Pozicije su zauzete. Politika je sve to prešutno dopustila. Ukrali su narodu nogomet za šaku Judinih škuda. U Izvršnom odboru saveza 11 od 17 članova Izvršnog odbora bilo je iz HDZ-a. Preko županijskih nogometnih saveza, opet preko HDZ-a, postavljena je kompletna Skupština HNS-a, bez utjecaja klubova. Ukinuto je udruženje prvoligaša, glasniji navijači su šikanirani, praćeni. Čudnim zakonom oduzeta su i ustavna prava navijačima. Zamislite, klub sam može zabraniti ulaz na stadion nekim navijačima, kojima oni to zažele bez odluke suda ili policije.  Prvi zakon izmijenjen inicijativom izvan Sabora  I normalno da je vrhuški klubova i politici, koji dobro zarađuju od nogometa, smetala ta demokracija, pravo glasa. Pokušali su ušutkati navijače. Kao nekad u nekim mračnim vremenima, prije Domovinskog rata. Samo, navijački pokret nije više neka tamo drogirana rulja kakvom su je htjeli prikazivati neki medijski bardovi. Navijači su danas i znanstvenici, pravnici, matematičari, filozofi, sociolozi, umnogome intelektualno ispred onih koji drmaju savezom. Naš Hajduk i Torcida su preko Hajduka, uz suradnju pravnih stručnjaka i stručnjaka za ustavno pravo, uspjeli čak preko zastupnika u Saboru izmijeniti i Zakon o sportu. Nakon 27 godina to je prvi zakon izmijenjen inicijativom izvan Sabora.  Iznenađena bahata politika i savez ni to nisu htjeli prihvatiti. Zar će im neki tamo navijači oduzeti slatku lizalicu transfera i bogaćenja? Zar će im neki navijači ispasti pametniji od njih?  Svi ti događaji su navijačima otkidali komadić po komadić srca, jer navijači vole Hrvatsku. Pratili su je u neke države za koje selfie navijači nisu ni čuli. Dolazili na prvenstva bez kune, spavali po parkovima, glasno bodrili do iznemoglosti. Sve to je jednom Modriću omogućilo da u njemu srasta taj talent koji ima, i da izraste u takvog igrača kakav je.  ""Nekolicina ukrala nogomet , ukrala i  Hrvatsku""  Međutim taj isti Modrić dok je suze ronio kod poraza Hrvatske na terenu bio je i bankomat Mamiću. I kako ga onda voljeti. Kako voljeti jednog Srnu koji je veliki humanitarac i donator kad sve zna i šuti. Zna kako je iz Hajduka otišao u Ukrajinu, zna što se događa u savezu, a opet napada navijače. Previše je to licemjerno za jednog navijača koji dobije po kostima svaki tjedan na stadionima. A zašto dobije? Zato što se buni da mu je nekolicina ljudi ukrala nogomet, da mu je ukrala Hrvatsku. I dobro bi bilo da navijač nije u pravu pa da ih se može s razlogom optužiti za mržnju prema Hrvatskoj. Samo u ladici sudstva stoje teške optužnice za vrh saveza, uz pomoć istih tih igrača na terenu.  A dosta je bilo da jedan Modrić i Srna izađu ispred javnosti i kažu: Ne, nećemo igrati iduću utakmicu dok se ne riješi situacija u hrvatskom nogometu. Ne, ne želimo da netko mlati i šikanira navijače. Ne, nije u redu da hrvatski nogometni prvoligaši nemaju utjecaj u Skupštini HNS-a. Ne, nije u redu da nema dijaloga s navijačima.  Ipak, oni su odabrali šutnju i licemjerje. A znaju sve.  A zar je normalno da Hrvatska ne želi gostovati u Splitu, u gradu koji i uz sva šikaniranja ima na stadionu prosjek od 12.000 navijača, a Hajduk se sa 43.305 članova nalazi u svjetskom vrhu po broju članova kluba. Na Rivi se okupi 30.000 navijača u prosvjedu.  Pendrek, korupcija, pogodovanje, prešućivanje  Tužna je ta Hrvatska navijačka priča koju obični čovjek nažalost ne razumije. Samo taj isti se čovjek nije nešto bunio ni kad se privatiziralo na čudan način tvrtke ni onda kad se dogode i druge nezakonite stvari u pravosuđu i policiji \xe2\x80\xa6 jer obični čovjek je uškopljen, gleda samo sebe, i onda se čudi kako jednog dana nema nikoga da njemu pomogne. Ipak je lakše kad neki navijač stoji na podu i netko ga cipelari pa će ga i on jednom udarit u kosti. Njemu će uvijek biti čudno zašto pravi nogometni navijači ne navijaju za Mamićev bankomat, jer ipak je to Hrvatska \xe2\x80\xa6 a ne, nije \xe2\x80\xa6  Ona samo nosi taj naslov, kao što i HNS nosi prefiks lijepe naše, a on nije naš. Nije hrvatski. Privatizirani su na najgrublji način. Pendrekom, korupcijom, pogodovanjem, prešućivanjem.  I zato, ti obični čovječe, pokušaj razumjeti zašto neki navijači ne mogu navijati za tu \xe2\x80\x9erepku"", a u srcu krvare jer vole Hrvatsku. Veća je to ljubav i žrtva prema Domovini od ijedne koju poznajete.  Renato Čupić.",1
Napokon prije nekih 5 godina...,2
Nije bio konzum nego UNIKONZUM bjelo zeleni natpis .,1
Ovaj Kujundzic je bolestan! Hitno s njim na lijecenje!,1
dobar vam je naslov..svaka čast novinaru..taman u rangu indexa,1
kad ti krava smrsavi ili je bolesna ili se tera...,2
"Norveška jest jedna od najbogatijih država u Europi i zato jest tako. Srećom da u vladi nemaju političare kao mi jer odavno bi se to sve prominiti. Kod njih nakon dolaska na vlast nove garniture je uvik bolje,  a kod nas sa smjenom političara sve gore i gore.",3
"Kad gledam te njihove reklame za Konzum koje se vrte zadnjih dana ne znam dali bi se smijala ili plakala... prodavacica i prodavac sa sirokim osmjehom prolaze Konzumom sa najsjajnijim osmjehom na licu i presretnog izraza lica i sjajnih ociju u prolazu si""bace pet"" ahahhaha o tugo zalosti...",1
"Bas sam se jucer to isto pitala i zbog reklama na tv-u. Pokusavaju nas udobrovoljiti, pa da kazemo ""ma daj lovu iz drzavnog proracuna da ih spasimo kad su sa nama i uz nas vec tolike godine! Sta bi mi bez njih?!"" Ja nemam godina toliko da ih pamtim na ovim prostorima 60 godina, ali bome ni u ovom periodu koliko zivim, primjetila sam ih tek devedesetih. I da ih nema ima i drugih.",1
Eldorado za dobrog odvjetnika.,2
"Maqui bobice najljekovitija i najzdravija biljka i voće na svijetu ( 27000 najzdravijih, najljekovitijih antioksidansa koji postoji- liječe sve), pasji trn- liječi gotovo sve, acerola- kraljica vitamina i minerala, mangosteen-kralj vitamina, antioksidansa, minerala , manuka med( certifikat UMF- najbolji, najljekovitiji i najzdraviji med na svijetu koji liječi sve), moringa ( liječi preko 300 bolesti), spirulina, chia sjemenke, reishi gljiva( najzdravija i najljekovitija gljiva na svijetu koja liječi gotovo sve i još puno njih.",2
"Dajte molim vas. Pa Šta je on lose uradio. Protiv pedera i lezbaca i svega različitog ste. A oni ""normalni"" Šta rade sa dicom?  Jučer čitam kako je par""normalni"" ostavio  bebu od 1 dan u šumi i kako su joj mravi izgrizli oči. Nakon 10 min čitam mladog oca i majku koji su zapalili bebu benzinom. Da je bar više ovakvih  ljudi.",3
"Stipe Jurič a Brejvik kada je ubio 70 ljudi iz puske,kako bih ti njega kvalificirao,terorista ili ludjak ili bilo sto?  Bez obzira sto je Brejvik katolik ja nemislim da ste ti i on isti,nikakve religijske veze nemaju Brejvik i ovaj u Londonu oni su za mene bolesne ubice a ne katolik ili musliman  Da su oni istinski vijernici nebi radili to sto rade  Pokusaj malo pozitivno razmisljati",3
Nije niti u Islamu ali je zalosno sto ljudi opcenito to neshvacaju  Imam srece pa imam muslimanskih prijatelja i puno toga sto Isil i ostatak bagre radi nema veze sa vjerom vec sa poremecenim umom Kako u islamu tako i kod katolika Netreba sve trpat u isti kos Nismo svi isti I oni dosljedni svojoj vjeri ostali su na svojoj zemlji i brane svoje a nazalost u Europu dolaze poremeceni umovi,3
Ruzica Zovko Tata ti zločinac :D ovo je Franjin mentor.,3
To dečki!Jebite im majku bar vi jer ostatak Hrvatske zabio je glavu u pijesak.,3
"Ma sve je to meni jasno i ja sam protiv mamica i ostalih u hns-u,ali ljudi zar ne shvacamo da s tim neredima necemo nista napraviti,pa oni nece otici ni ako nas izbace radi nereda,kako to ne shvacate",2
Najvise me zabrinjava kako takvi ko doticna odgajaju djecu :/,2
Iva Babić kurvo prljava,3
Joža.......je legenda neka živi  vječno,2
"Josip Grma Vrnavic , tebi više ni tvoj onaj gore ne može pomoći...Ili je to od rođenja? Smiješan si..21. stoljeće je...Da li si toga svjestan?",1
Kretencino glupa! Nebi ti dao da budes ministar poljskog wc-a a kamoli zdravstva!!!,3
"Tako je, znači 5 svećenika umjesto 100 doktora i pacijentima će biti puno bolje, a doktori neka idu u zapadne zemlje gdje neuki ljudi još uvijek vjeruju da doktori liječe i nisu spoznali snagu svećenikovog osmijeha u izliječenju.",3
"Jedini premijer koji se otvoreno borio protiv kriminalaca,da se razumijemo imao je i on svojih gresaka!",2
"Milanović je legenda, političar od formata ,britak nenadjebiv retoričar.",1
"Posljednji njegov cuvar je mogao samo stavit pod jezik kapsulu cijanida,,ovo je prica za masu.",2
"Boje se da se ne otkrije da su svi iz istoga legla, i HDZ i SDP.",2
Pero Petrovic ti si kreten,2
"Dovoljno je da opet bude poneka baklja i ""neprimjereno ponašanje"" navijača uzvicima ""za  dom spremni"" i eto opet praznih tribina. :-)",3
Koja pravna drzava? Sve je samo nije pravna.,1
Sad i njega politi benzinom ali dio po dio tjela tak da više osjeti bol monstrum,3
"Svima koji su otišli svaka čast na odluci jer trebalo je hrabrosti.....ali i svi koji ostaju moraju imati hrabrosti za život u ovoj zemlji jer nitko vam ovdje nažalost neće pomoći već jedino možete pomoći sami sebi....prema tome: kako god odlučili odluka je vaša....samo u zadnje vrijeme slušam da ljudi oko mene sve više odlaze, izuzetno rijetko se vraćaju....dom ti je tamo gdje imaš sredstva za normalan život a ne tamo gdje ti stoji kuća",1
"Gradonačelnik Londona, Sadik Kan, koji je iz Pakistana, kaže da se ljudi morau priviknuti na to da su teroristički napadi dio životnog stila velegradova. KOMENTAR Vrijeme je da se lik vrati natrag u Pakistan.",3
"Najtužnije je to što ju najviše žene nazivaju svakakvim pogrdnim imenima. Ja ne bih mogao ni psu na ulici reći da je ružan, a kamoli ljudskom biću.",1
Postao ministar ni sam ne zna kako i sada se zajebava sa sirotinjom.Ako si tako sposoban onda napravi nešto za te o kojima pričaš,1
Jebite se govna lazljiva,3
Sve izgubili dabogda!,3
"Jeftin Mostov populizam, šta je šteta od 3000kn prema reklami u svim medijima.",1
"S kojeg si ti planeta sav iskompleksiran,Bože sačuvaj nas od ovakvih morona....",3
Pero Petrovic samo glupače na tebe padaju ja nebih ni biciklo oslonila na tebe fuj povrača mi se od takvih debila.,3
pero ima malog pišu!,3
"komunjero? hahahaha pa ta tvoja Bruna na koju drkaš svaki dan je komunjara na kvadrat ... bez dana rada u realnom sektoru, prava uhljebarka :D",3
gledajući u praksi skoro pa i da je obavezan predmet,2
"Kad sam u 5. razredu osnovne škole doselila u Osijek roditelji su me upisali u OŠ Jagoda Truhelka u koju je išao i moj otac. Nedugo nakon početka nastavne godine u učionici hrvatskog jezika mi je na glavu pao prozor. Gotovo sam iskrvarila čekajući u hitnoj, u školu nisam išla mjesec dana, od Croatia osiguranja sam dobila 150kn, a kao šlag na tortu škola je tražila da moji roditelji plate prozor (130kn). Taj događaj nije podigao medijsku prašinu no bilo je to devedesetih, a ja sam (za razliku od dječaka koji je za ruku slomljenu izvan nastave i kruga škole dobio, ako se ne varam, nekoliko tisuća kuna) imala ""egzotično"" prezime. -_-",1
Bitno da se grade jebene fontane i crkve dok se škole i bolnice raspadaju....,1
"Meni meni je najbolji dio života bija živjeti s roditeljima. Tople ruke moje majke , briga mojih roditelja. Obuci potkosulj, ajde jedi, donesi mami drva, idi mami kupi cigare, dođi do ponoć doma. Oprano, očišćeno, frižider pun, raČuni plaćeni, roditelj sve ti da sve, ako treba i zalogaj iz usta, neznas to cijeniti dok se ne osamostalis. Mama , tata falite \xe2\x9d\xa4",3
znate li koliko iznosi alimentacija? Koliko roditelj plaća bez obzira na iznos koji sud odredi? Koliko često drugi roditelj tu dužnost ne obavlja? Ima li dijete pravo da se roditelji brinu za njega? Ukoliko se jedan roditelj ne brine tko bi se trebao brinuti za djetetova prava? Da li je zaštita prava djeteta obaveza roditelja skrbnika? Znate li koji su razlozi zbog kojeg se neka žena odlučila razvesti?,1
"Ja sam rodila u zaboku  I nisam smjela piti vodu i jesti jer mi je sestra na lijepo objasnila zasto i sta se moze dogoditi ako zavrsim na carskom ali nitko ne sprijecava da prije nego dodjete u boks pojedete nekakav sendvic,keks,voce sta je pri ruci jer ne znate koliko cete tamo biti  Imala sam ponudjenu i loptu,i strunjacu i uze nekakvo osjecala sam se kao u skolskoj dvorani  Babica je objasnila i kako i zasto sluzi klistir  Tako da stvarno samo pohvale i preporuke",2
"Rodila sam dvaput, 2006. i 2012.g., oba puta u KBC Rijeka i imam samo pozitivna iskustva! Palac gore za riječku ekipu!!!",3
Provokator s fejk profila :D nemas ocito testise napisati takvo sto s pravog profila,2
Kakav lik moraš biti da te ni Conan ni Terminator ne vole ????     :-/,2
Prikladan naziv za ispračanje djece u bolji život negdje drugdje,2
"Meni je bio dobar i Pleso kad sam dao gas iz Apsurdistana, i čak me nije nitko ni otpratio.",2
Nova vrata Hrvatske... izlazna,1
Onaj tko zadnji izade neka ugasi svijetlo makar smo vec dugo u mraku ali onom umnom bolje receno totalna pomrcina u glavama.,1
Plesu...,2
Turska tvrtka.... to sve govori!! Nema hrvatskih firmi........?,3
"Ines Sappe; recimo aerodrom JFK u NY je nazvan po jednom od najboljih predsjednika, koji je radio na dobrobit naroda, zbog čega je i izgubio glavu! Zatim, recimo aerodrom K.M. Ataturk u Istanbulu nazvan je po nekome tko je itekako zadužio turski narod, svrgnuvši osmansku ostavštinu, kroz uvođenje sekularnosti i jednakosti za sve. A Tuđman, on je netko tko je predsjedao državom dok je bio rat i za taj mu vremenski period svaka čast, ali je nakon toga predsjedao i državom dok su se stvarale bogate obitelji, kroz kriminalnu pretvorbu i privatizaciju, na štetu svih nas! Stoga, postoji razlika između različitih svjetskih predsjednika i povijesnih ličnosti. Neke povijesne ličnosti su bili državnici s vizijom i radom na viziji, zbog dobrobiti svih, a ostali su bili samo obični zavedeni političari.",3
"Lijep je ovaj novi/stari #Pleso za sve građane koji putuju kao turisti, a aerodrom #Tuđman je samo ironija za sve mlade koji zauvijek napuštaju domovinu!",1
Mislim da je Index vidno tamno zelen od muke ....,3
Vidim da uistinu  imam sve kriterije  za predsjednicu.  Tako da ću se kandidati.,1
Uz dobar izgled to je Dama koja zna kako se obući ! Bilo bi uputno da se žene suzdrže komentara jer bilo kakav komentar se može protumačiti i ovako i onako - najčešće se radi o zavisti !!,1
Drago mi je. Nadam se da ce se to zavrsiti lose za SAD i da ce se na njegovom prostoru napraviti ogroman gulag kao kazna za sve americke zlocine,3
"kolindica zapela za avioncice pa nek si kupi 2 jedan jakovu i jedan sebi pa neke lete i ratuju gdje zele, a ne s nasom djecom ispred sebe.",1
Ma isti su,2
Zaboravio si napisati i jadransko more.,2
"jel ovo neka šala ili???? ako nije ,tog luđaka spremiti u umobolnicu doživotno",2
A \xc3\x9fta ona ne ode u Švedsku zauvijek recimo....,2
Ako se nevratite maric ce vam uzet nekretnine da bi spasio tatu.,1
Jača je od Mesića u pričanju viceva :),2
"Pa nismo popozdili..... Ja bih se vratila samo kad bi ova Vlada pala, kad bi se totalno izmijenilo cjelokupno korumpirano vodstvo(u svim segmentima), kad bih imala siguran posao s europskim placama i besplatno zdravstvo(ali apsolutno sve).....",1
"Evo odma  cu da krenem,zbog takvih Sam i otisao!!!nisi dobre glave nikako !!",1
Ja imam povecu surlu i povecu kitu.:-),3
"Stvarno morate promijeniti ime u  -IMBECILDEX - !!! Policajac na lijevom laktu već ima jedan takav bijeli cvijet, koji mu je vjerovatno dala ta ista djevojčica. On joj to ljubazno pokazuje i objašnjava mimikom lica !!! Imbecili, dajte se naučite najprije dobro pregledati video , a onda iz njega pravite svjetsko čudo i vrijeđajte osobe koje su to zaslužile !!! Imate ih u Hrvatskoj koliko samo poželjeti možete.....",3
"Svaka cast Davidu! Prokuzil je ljude i njihov karakter i znao je tocno kako ce ljudski rod reagirati kad su u pitanju novci i zlato! Tata i djed su ga to dobro naucili... Vi mislite da je on glavni Neprijatelj Ljudske rase!  Ne budite smijesni... Pogledajte se u ogledalo!? Bez vase pomoci Njemu nista nebi uspjelo... Za sve lose sta pogadja ljudski rod najveci krivci su ti isti ljudi! Ta njihova,ta Vasa Kratka pamet,taj Vas mozak corave kokosi... Drugo niste ni zasluzili! A bit ce samo jos gore jer iznenadili bi se kad bi znali da je David koliko toliko drzao kontrolu pod svojom komandom! Sad nastaje Kaos! Ali to ste sami trazili...",1
jel voliš u dupe ?,2
"...ne živim niti blizu Splita, pa me baš briga za ove izbore..ali ne mogu vjerovati da još ima ljudi koji svoj glas daju ovoj lijenčini i lopovu Kerumu!??!? Nevjerovatno..da nije tragično, bilo bi smiješno do bola...",1
"Ne postoje repovi, nego ih vi mediji stvarate. Tko je ovo urlao? U tom trenutku baš NIJEDAN igrač Slavena ne traži faul, ovaj na podu ostaje gledati što će se dalje dešavati, Kopić ništa ne spominje. Kako očekujete od suca da situaciju vidi kao faul ako ni sam igrač to ne traži, a ni nitko drugi?",2
pametan covjek haha,2
Jako bi njega pogodilo da san ja umra,2
Jel XT na prodaju?,2
Dovoljno je pogledati fotografije tog malog. Sve je jasno.,2
Olakotna okolnost iz ugledne je obitelji jadan uzet će sud u obzir da je ostao bez roditelja i kako će on sada križ život sam nema tko da ga usmjeri i izvede na pravi put tako da bude uzor mladima kako je njemu teško kroz to prolaziti bez majčine i tajine ljubavi,3
Govno jedno pokvareno,3
"da samo profesora.. cijelo drustvo je tu hdz, sdp, žz.. ne znam samo kako su ih sve uspjeli ugurati u jednu sliku",2
Cindy je bila i ostala bomba. Ni godine je ne uništavaju.,2
Kutle je odavno ovu metodu doktorirao... I ovi su sad nedavno kupili Mercator... i Kutle je sve kupovao..  Sve je to ista shema... ponzijeva shema... samo kad je radi individualac onda je ilegalna a kad je radi država ili velika firma onda je to OK... jer naše mirovinsko nije ništa drugo nego prevara... Agrokor je prevara... Cijeli kapitalizam je prevara ali se jako strogo postavljat prema malima fa imaju privid pravde a ne magle...,1
Nabijem ih na kurac oboje,3
Stručnjak za kurac je taj bizon.!,3
ja sam bil dole par puta ... nisam stekel taj dojam o podjednakom broju dece ... niti približno ...,3
"Iličić je strucnjak za sva podrucja,a ako nesto slucajno i ne zna...tu je Željka Markić :D",1
"Dejan Brkljačić, biti vozač kamiona je način i stil života. To što si ti svaki dan doma i svako veće u svom krevetu, to je lijepo. Vidiš,ja da sam to tako htjeo, onda nebih bio vozač kamiona u međunarodnoj špediciji, nego bih bio kao i ti!",3
"ubio ga mercedesom, motorom, a i majka ga je kao jedinca sigurno puno mrzila, ma o čemu pričaš čista obijest",3
"Kako se voze, tako i zavrse...da ne divljaju, ne bi ni letili...",3
Ti si baš pravi primjer primitivca o kojem on govori....dokaz da je rekao istinu,1
"Necije moralne vrednote se ne odreduju po tome sto taj netko nosi ili ne nosi, prika moj. Al tesko to nekome shvatiti.",1
"ova se bogami dobro uvukla Kolindi u guzu,ništa ne viri vanka.Ministričino rođenje je također splet nesretnih okolnosti.",1
"polit benzinom i zapalit. naravno - ne majice, nego istomisljenike autora clanka.",3
"Poserem vam se na taj trend i na one koje ga prate, a pojma nemaju o bendovima cije majice nose.",2
"Ma daj ser*m se na vas i na takvu modu, svi se skupili u neki cajkaski klub razbijaju se case do jutarnjih sati na neku tamo suputicu,sevku i nemam ti ni ja pojma koju vec, a AC/DC na majci, ma puuuj gamad jos malo necu znat prepoznat nikog, sve sami klonovi ove danasnje zenske....",3
kretenčino,3
Moguce je to znam mnoge koji to rade takodjer i ja,2
Zar ste mislili da će biti drugačije pa dosada je on financirati HDZ sad mu vrAcaju pa postavili su cijelu vladu Todorić i njegovi prijatelji sve kupi za 1 kunu,1
"28000 u Hrvatskoj radi u Agrokoru gospodine...sto ja imam s tim?? 300.000 ljudi je na burzi!!! Kad se pomogne njima koji su mnogi zbog Agrokora na cesti, onda moze i radnicima iz Agrokora, ne prije....isto kao Pevec treba, stecaj i onda sve nanovo bez Todorica...dosta smo ga pomagali i do sad, a bez naseg znanja i htijenja..DOSTA JE!!",1
"Poštovana gospođo ovo što ste napisali nema veze s mozgom.Dali vi uopće znate što želite za svoje sinove.Biti pošten i da se dalje ne izrazim nemože.Jedan čas želite da na svojoj koži osjete uspone i padove živote a na drugoj im ne želite Simonice Katanićke.Bit će svega samo pustite sinove da žive svoj život a ne vaš .. Kad dođe vrijeme oni će izabrati što oni hoće ako se vi ne budete mješala . Puno teksta bez veze vi izgleda ni sama neznate što želite. Kod toliko filozofiranja može vam se lako dogoditi oštrokondža , Simonica ili Katanićka.",1
Pink panter napada,2
Otkuda ste javite i dojdem po nju,2
"Odmah ga šaljite u Rijeku,  molim Vas ovo je Japanski čin isti naš Johnny",2
"Pomorci i putnici avionima i slicno mjenjaju sate svaki dan i cesto i svakako,zbilja neznam cemu price da steti zdravlju.... pusenje steti zdravlju i alkohol i stres a ne jedan sat dva puta na godinu....",1
"Za sve koji nisu pratili nastavni program u osnovnjaku (kao autor ovog patetičnog članka), odgovor leži u vremenskom razdoblju kruženja zemlje oko sunca, a ne u nekoj kapitalističkoj ideji o učinkovitosti. Sudeći po količini iznesenog *ranja, autor ovog članka vjeruje da se sunce okreće oko zemlje hihihi",1
A u kojem je trenutku svizac zamotao čokoladu?,2
"Hm, interesantno. Velikog vođu ne smeta kada njegov pijun otvoreno zagovara ustaštvo, ali nesmije protiv jednoumlja. Dobra poruka svim HDZovcama.",1
Nisu oni stoka seljacka vec srbo yugoslovenska,3
Ja nisam glasala za nju a onaj koji je neka joj se i uvlači u guzicu! A kad bi se brinula za narod koliko se brine šta će obući u ovoj državi bi već bilo bolje! Kokoš koja sramoti sebe i ovu državu!,1
"Barbika je bila i ostala, a stace zena nije kriva onim zlobnim dusama  zato sto nemogu bit kao ona, prelijepa nasa predsjednce volimo te svi, bices nam jos dugo, dugo na vrhu.",3
"Ja znam da to nije posao nogometasa,ali zaista imaju fantasticna primanja i zalosno je da ne pomognu kad nam je zdravstvo tako jadno. bravo!",2
tave skulpture mi drže drva da se ne rasipaju..........malo više skromnosti ne bi bilo na odmet.......,2
"Aj majke ti baba nauci pisati onda se javi,moze??bijelo ili crno svugdje se moze kupiti,ne pizdi,,,,prvo sama promjeni dilera pogledaj se na sto slicis,psttt",1
Navedi mi jedan skup gdje su ustase marsirale?!,3
"Elvedin Omercic,seljacino copava nekulturna,dok ima takvih kretena ko ti nece nikada biti problem na Balkanu zapalit sibicu!",3
bravo druze..ziv bio..pozdrav od srbende..,1
"A tebi?? Hihihi bas si mrak, bas si cool!",2
"Zar se taj sdp-e toliko raspao da ce podrzat hns-ovu kandidatkinju za gradonacelnicu,,,sramota",3
Legalizacija joj je bio najbolji potez! Omogucila vam je da legalno imate nesto sto ste nelegalno izgradili i da platite oni sto je sav posten svijet platio!,1
"E nečeš kornjačo  biti gradonačelnica , ta spodoba nas je dosta unazadila pa i previše.. marš govnarko ,,,,,,",3
Kaj ti karikatura da vodis Zagreb ma nisi Bandicu ni dokoljena nemoj se sramotit ti svaljekica podmikla sakri te se pod tepih bolje vam je,3
"Svi vi političari znate sve o Agrokoru, prestanite zatupljivat ovaj jadni narod. Ako vam je to adut za izbore onda ste svi jadni prejadni...",1
